answer_by,ques,views,vote,weblink
Joel James ,How do we determine the number of days for a given month in python [duplicate],"Viewed 174,175 times",186,https://stackoverflow.com/questions/4938429/how-do-we-determine-the-number-of-days-for-a-given-month-in-python
the Tin Man,"Why is ""import *"" bad?","Viewed 69,643 times",186,https://stackoverflow.com/questions/2386714/why-is-import-bad
AGN Gazer,How do you read a file into a list in Python? [duplicate],"Viewed 704,079 times",186,https://stackoverflow.com/questions/3925614/how-do-you-read-a-file-into-a-list-in-python
Peter Mortensen,What is choice_set in this Django app tutorial?,"Viewed 31,942 times",187,https://stackoverflow.com/questions/2048777/what-is-choice-set-in-this-django-app-tutorial
Wipqozn,Django: Redirect to previous page after login,"Viewed 115,258 times",187,https://stackoverflow.com/questions/806835/django-redirect-to-previous-page-after-login
AgentLiquid,Why is there no GIL in the Java Virtual Machine? Why does Python need one so bad?,"Viewed 19,328 times",187,https://stackoverflow.com/questions/991904/why-is-there-no-gil-in-the-java-virtual-machine-why-does-python-need-one-so-bad
nbro,How do I select elements of an array given condition?,"Viewed 297,653 times",187,https://stackoverflow.com/questions/3030480/how-do-i-select-elements-of-an-array-given-condition
johnnyRose,'dict' object has no attribute 'has_key',"Viewed 243,818 times",187,https://stackoverflow.com/questions/33727149/dict-object-has-no-attribute-has-key
wim,Access nested dictionary items via a list of keys?,"Viewed 157,201 times",187,https://stackoverflow.com/questions/14692690/access-nested-dictionary-items-via-a-list-of-keys
Martijn Pieters,Flask raises TemplateNotFound error even though template file exists,"Viewed 230,957 times",187,https://stackoverflow.com/questions/23327293/flask-raises-templatenotfound-error-even-though-template-file-exists
martineau,Best way to structure a tkinter application?,"Viewed 230,572 times",187,https://stackoverflow.com/questions/17466561/best-way-to-structure-a-tkinter-application
smci,How to round a number to significant figures in Python,"Viewed 292,777 times",187,https://stackoverflow.com/questions/3410976/how-to-round-a-number-to-significant-figures-in-python
David Guyon,"numpy.where() detailed, step-by-step explanation / examples [closed]","Viewed 200,608 times",184,https://stackoverflow.com/questions/34667282/numpy-where-detailed-step-by-step-explanation-examples
hoefling,Logging within pytest tests,"Viewed 150,379 times",184,https://stackoverflow.com/questions/4673373/logging-within-pytest-tests
davidism,How do I know if I can disable SQLALCHEMY_TRACK_MODIFICATIONS?,"Viewed 112,910 times",184,https://stackoverflow.com/questions/33738467/how-do-i-know-if-i-can-disable-sqlalchemy-track-modifications
serv-inc,How many concurrent requests does a single Flask process receive?,"Viewed 146,711 times",184,https://stackoverflow.com/questions/10938360/how-many-concurrent-requests-does-a-single-flask-process-receive
user1569317,"If list index exists, do X","Viewed 385,864 times",184,https://stackoverflow.com/questions/11786157/if-list-index-exists-do-x
Samuel Liew,Reading and writing environment variables in Python? [duplicate],"Viewed 403,594 times",184,https://stackoverflow.com/questions/5971635/reading-and-writing-environment-variables-in-python
Thomas Jung,Define a lambda expression that raises an Exception,"Viewed 61,305 times",184,https://stackoverflow.com/questions/8294618/define-a-lambda-expression-that-raises-an-exception
Neuron,Open file in a relative location in Python,"Viewed 666,841 times",184,https://stackoverflow.com/questions/7165749/open-file-in-a-relative-location-in-python
Mark Amery,How to check if variable is string with python 2 and 3 compatibility,"Viewed 99,199 times",184,https://stackoverflow.com/questions/11301138/how-to-check-if-variable-is-string-with-python-2-and-3-compatibility
Willy Nelson,How to display the current year in a Django template?,"Viewed 64,891 times",184,https://stackoverflow.com/questions/6259775/how-to-display-the-current-year-in-a-django-template
Arthur B.,Modifying a subset of rows in a pandas dataframe,"Viewed 181,350 times",184,https://stackoverflow.com/questions/12307099/modifying-a-subset-of-rows-in-a-pandas-dataframe
Amandasaurus,Django Admin - Disable the 'Add' action for a specific model,"Viewed 62,879 times",184,https://stackoverflow.com/questions/4143886/django-admin-disable-the-add-action-for-a-specific-model
Ciro Santilli Путлер Капут 六四事,How to make lists contain only distinct element in Python? [duplicate],"Viewed 319,913 times",184,https://stackoverflow.com/questions/4459703/how-to-make-lists-contain-only-distinct-element-in-python
Phillip,"Flask SQLAlchemy query, specify column names","Viewed 197,409 times",184,https://stackoverflow.com/questions/11530196/flask-sqlalchemy-query-specify-column-names
Isaac,Clear text from textarea with selenium,"Viewed 314,339 times",184,https://stackoverflow.com/questions/7732125/clear-text-from-textarea-with-selenium
Jake,python tuple to dict,"Viewed 257,632 times",184,https://stackoverflow.com/questions/3783530/python-tuple-to-dict
BlueRaja - Danny Pflughoeft,Filtering a list based on a list of booleans,"Viewed 141,299 times",181,https://stackoverflow.com/questions/18665873/filtering-a-list-based-on-a-list-of-booleans
pppery,AttributeError: 'module' object has no attribute 'urlopen',"Viewed 382,368 times",181,https://stackoverflow.com/questions/3969726/attributeerror-module-object-has-no-attribute-urlopen
cs95,Get total of Pandas column,"Viewed 479,519 times",181,https://stackoverflow.com/questions/41286569/get-total-of-pandas-column
Jader Dias,How to enumerate an object's properties in Python? [duplicate],"Viewed 207,804 times",181,https://stackoverflow.com/questions/1251692/how-to-enumerate-an-objects-properties-in-python
Florian Pilz,open read and close a file in 1 line of code,"Viewed 243,202 times",181,https://stackoverflow.com/questions/8011797/open-read-and-close-a-file-in-1-line-of-code
Salvador Dali,How to check if a word is an English word with Python?,"Viewed 245,997 times",181,https://stackoverflow.com/questions/3788870/how-to-check-if-a-word-is-an-english-word-with-python
greybeard,How to change default Python version?,"Viewed 680,414 times",181,https://stackoverflow.com/questions/5846167/how-to-change-default-python-version
Joan Venge,Is it ok to use dashes in Python files when trying to import them?,"Viewed 106,743 times",181,https://stackoverflow.com/questions/761519/is-it-ok-to-use-dashes-in-python-files-when-trying-to-import-them
Nathaniel Jones,"When would the -e, --editable option be useful with pip install?","Viewed 96,936 times",182,https://stackoverflow.com/questions/35064426/when-would-the-e-editable-option-be-useful-with-pip-install
David Robinson,Can't import my own modules in Python,"Viewed 424,093 times",182,https://stackoverflow.com/questions/9383014/cant-import-my-own-modules-in-python
Braiam,Type hints with user defined classes,"Viewed 77,404 times",182,https://stackoverflow.com/questions/44664040/type-hints-with-user-defined-classes
dfarrell07,Using Django time/date widgets in custom form,"Viewed 131,438 times",182,https://stackoverflow.com/questions/38601/using-django-time-date-widgets-in-custom-form
ShadowRanger,TypeError: module.__init__() takes at most 2 arguments (3 given),"Viewed 178,230 times",182,https://stackoverflow.com/questions/14583761/typeerror-module-init-takes-at-most-2-arguments-3-given
Aryan Beezadhur,How can I check if character in a string is a letter? (Python),"Viewed 533,102 times",182,https://stackoverflow.com/questions/15558392/how-can-i-check-if-character-in-a-string-is-a-letter-python
Konrad Rudolph,Unable to allocate array with shape and data type,"Viewed 586,304 times",182,https://stackoverflow.com/questions/57507832/unable-to-allocate-array-with-shape-and-data-type
Islam,Reading in environment variables from an environment file,"Viewed 221,941 times",178,https://stackoverflow.com/questions/40216311/reading-in-environment-variables-from-an-environment-file
Peter Mortensen,How can I convert a .py to .exe for Python?,"Viewed 513,724 times",178,https://stackoverflow.com/questions/41570359/how-can-i-convert-a-py-to-exe-for-python
Ian Elliott,"In Python, how do I index a list with another list?","Viewed 205,232 times",178,https://stackoverflow.com/questions/1012185/in-python-how-do-i-index-a-list-with-another-list
SRKX,How to estimate how much memory a Pandas' DataFrame will need?,"Viewed 128,460 times",178,https://stackoverflow.com/questions/18089667/how-to-estimate-how-much-memory-a-pandas-dataframe-will-need
orome,Showing line numbers in IPython/Jupyter Notebooks,"Viewed 189,780 times",178,https://stackoverflow.com/questions/10979667/showing-line-numbers-in-ipython-jupyter-notebooks
feetwet,how to check the dtype of a column in python pandas,"Viewed 355,398 times",178,https://stackoverflow.com/questions/22697773/how-to-check-the-dtype-of-a-column-in-python-pandas
Trenton McKinney,Combine Date and Time columns using python pandas,"Viewed 183,264 times",178,https://stackoverflow.com/questions/17978092/combine-date-and-time-columns-using-python-pandas
Usama Abdulrehman,Conditional Replace Pandas,"Viewed 346,333 times",178,https://stackoverflow.com/questions/21608228/conditional-replace-pandas
petezurich,Convert unix time to readable date in pandas dataframe,"Viewed 234,321 times",178,https://stackoverflow.com/questions/19231871/convert-unix-time-to-readable-date-in-pandas-dataframe
Brad Koch,How do I create a dictionary with keys from a list and values defaulting to (say) zero? [duplicate],"Viewed 239,339 times",178,https://stackoverflow.com/questions/3869487/how-do-i-create-a-dictionary-with-keys-from-a-list-and-values-defaulting-to-say
Nicolas Kaiser,Python mysqldb: Library not loaded: libmysqlclient.18.dylib,"Viewed 107,134 times",178,https://stackoverflow.com/questions/6383310/python-mysqldb-library-not-loaded-libmysqlclient-18-dylib
TylerH,How can I share Jupyter notebooks with non-programmers? [closed],"Viewed 149,084 times",179,https://stackoverflow.com/questions/31855794/how-can-i-share-jupyter-notebooks-with-non-programmers
vbence,What is python's site-packages directory?,"Viewed 202,748 times",179,https://stackoverflow.com/questions/31384639/what-is-pythons-site-packages-directory
Serjik,Django: Why do some model fields clash with each other?,"Viewed 40,371 times",179,https://stackoverflow.com/questions/1142378/django-why-do-some-model-fields-clash-with-each-other
popcorn,How do I include related model fields using Django Rest Framework?,"Viewed 98,745 times",179,https://stackoverflow.com/questions/14573102/how-do-i-include-related-model-fields-using-django-rest-framework
Dennis,How to add an integer to each element in a list?,"Viewed 348,665 times",179,https://stackoverflow.com/questions/9304408/how-to-add-an-integer-to-each-element-in-a-list
Mark Amery,Reloading module giving NameError: name 'reload' is not defined,"Viewed 169,943 times",175,https://stackoverflow.com/questions/961162/reloading-module-giving-nameerror-name-reload-is-not-defined
mkrieger1,Select 50 items from list at random,"Viewed 179,969 times",175,https://stackoverflow.com/questions/15511349/select-50-items-from-list-at-random
Thierry Lam,Python unit test with base and sub class,"Viewed 72,460 times",175,https://stackoverflow.com/questions/1323455/python-unit-test-with-base-and-sub-class
nbro,Pythonic way to check if a list is sorted or not,"Viewed 153,749 times",175,https://stackoverflow.com/questions/3755136/pythonic-way-to-check-if-a-list-is-sorted-or-not
Liza,How do you get a directory listing sorted by creation date in python?,"Viewed 256,104 times",175,https://stackoverflow.com/questions/168409/how-do-you-get-a-directory-listing-sorted-by-creation-date-in-python
Peter Mortensen,Not able to install Python packages [SSL: TLSV1_ALERT_PROTOCOL_VERSION],"Viewed 164,121 times",175,https://stackoverflow.com/questions/49768770/not-able-to-install-python-packages-ssl-tlsv1-alert-protocol-version
Peter Mortensen,Print a string as hexadecimal bytes,"Viewed 463,931 times",175,https://stackoverflow.com/questions/12214801/print-a-string-as-hexadecimal-bytes
fuentesjr,How to list only top level directories in Python?,"Viewed 210,241 times",175,https://stackoverflow.com/questions/141291/how-to-list-only-top-level-directories-in-python
db0,"Disable a method in a ViewSet, django-rest-framework","Viewed 69,127 times",175,https://stackoverflow.com/questions/23639113/disable-a-method-in-a-viewset-django-rest-framework
Elazar,NameError: name 'self' is not defined,"Viewed 220,113 times",176,https://stackoverflow.com/questions/1802971/nameerror-name-self-is-not-defined
martineau,Purpose of __repr__ method?,"Viewed 201,859 times",176,https://stackoverflow.com/questions/1984162/purpose-of-repr-method
Martijn Pieters,Python list iterator behavior and next(iterator),"Viewed 259,822 times",176,https://stackoverflow.com/questions/16814984/python-list-iterator-behavior-and-nextiterator
martineau,Why aren't superclass __init__ methods automatically invoked?,"Viewed 87,932 times",176,https://stackoverflow.com/questions/3782827/why-arent-superclass-init-methods-automatically-invoked
Community,Importing class from another file [duplicate],"Viewed 511,382 times",176,https://stackoverflow.com/questions/41276067/importing-class-from-another-file
Tomerikoo,"How to copy a 2D array into a 3rd dimension, N times?","Viewed 110,669 times",176,https://stackoverflow.com/questions/32171917/how-to-copy-a-2d-array-into-a-3rd-dimension-n-times
Ivan Kharlamov,Django dynamic model fields,"Viewed 82,720 times",176,https://stackoverflow.com/questions/7933596/django-dynamic-model-fields
Martin Tournoij,Windows Scipy Install: No Lapack/Blas Resources Found,"Viewed 272,250 times",176,https://stackoverflow.com/questions/28190534/windows-scipy-install-no-lapack-blas-resources-found
nbro,How do I get monitor resolution in Python?,"Viewed 257,784 times",172,https://stackoverflow.com/questions/3129322/how-do-i-get-monitor-resolution-in-python
Miguel Rueda,Is nested function a good approach when required by only one function? [closed],"Viewed 257,799 times",173,https://stackoverflow.com/questions/4831680/is-nested-function-a-good-approach-when-required-by-only-one-function
costrouc,Proper way to create dynamic workflows in Airflow,"Viewed 85,650 times",173,https://stackoverflow.com/questions/41517798/proper-way-to-create-dynamic-workflows-in-airflow
Augusta,Why doesn't print work in a lambda?,"Viewed 95,145 times",173,https://stackoverflow.com/questions/2970858/why-doesnt-print-work-in-a-lambda
yatu,what is the difference between 'transform' and 'fit_transform' in sklearn,"Viewed 126,235 times",173,https://stackoverflow.com/questions/23838056/what-is-the-difference-between-transform-and-fit-transform-in-sklearn
Boris Verkhovskiy,Allowing specific values for an Argparse argument [duplicate],"Viewed 88,129 times",173,https://stackoverflow.com/questions/15836713/allowing-specific-values-for-an-argparse-argument
SecretAgentMan,"Cython: ""fatal error: numpy/arrayobject.h: No such file or directory""","Viewed 109,866 times",173,https://stackoverflow.com/questions/14657375/cython-fatal-error-numpy-arrayobject-h-no-such-file-or-directory
sjmh,Python style - line continuation with strings? [duplicate],"Viewed 135,852 times",173,https://stackoverflow.com/questions/5437619/python-style-line-continuation-with-strings
bignose,"Re-raise exception with a different type and message, preserving existing information","Viewed 68,362 times",173,https://stackoverflow.com/questions/696047/re-raise-exception-with-a-different-type-and-message-preserving-existing-inform
the Tin Man,How to convert a boolean array to an int array,"Viewed 341,017 times",173,https://stackoverflow.com/questions/17506163/how-to-convert-a-boolean-array-to-an-int-array
Martijn Pieters,NameError: global name 'unicode' is not defined - in Python 3,"Viewed 286,352 times",173,https://stackoverflow.com/questions/19877306/nameerror-global-name-unicode-is-not-defined-in-python-3
Ataxias,Get Output From the logging Module in IPython Notebook,"Viewed 117,586 times",173,https://stackoverflow.com/questions/18786912/get-output-from-the-logging-module-in-ipython-notebook
Nico Schlömer,Matplotlib transparent line plots,"Viewed 201,176 times",173,https://stackoverflow.com/questions/4320021/matplotlib-transparent-line-plots
zero323,How do I add a new column to a Spark DataFrame (using PySpark)?,"Viewed 433,308 times",173,https://stackoverflow.com/questions/33681487/how-do-i-add-a-new-column-to-a-spark-dataframe-using-pyspark
Jorge Olaf,How to read and write INI file with Python3?,"Viewed 277,135 times",173,https://stackoverflow.com/questions/8884188/how-to-read-and-write-ini-file-with-python3
Riley Watkins,Renaming a virtualenv folder without breaking it,"Viewed 83,387 times",173,https://stackoverflow.com/questions/6628476/renaming-a-virtualenv-folder-without-breaking-it
Georgy,Find the most frequent number in a NumPy array,"Viewed 230,341 times",170,https://stackoverflow.com/questions/6252280/find-the-most-frequent-number-in-a-numpy-array
Sheena,How to avoid circular imports in Python? [duplicate],"Viewed 128,043 times",170,https://stackoverflow.com/questions/7336802/how-to-avoid-circular-imports-in-python
kmario23,What does tf.nn.embedding_lookup function do?,"Viewed 74,964 times",170,https://stackoverflow.com/questions/34870614/what-does-tf-nn-embedding-lookup-function-do
Trevor Boyd Smith,How to check if string input is a number?,"Viewed 760,756 times",170,https://stackoverflow.com/questions/5424716/how-to-check-if-string-input-is-a-number
wescpy,Why is my Python App Engine app using the Translate API getting an error of ImportError: No module named apiclient.discovery?,"Viewed 219,530 times",170,https://stackoverflow.com/questions/18267749/why-is-my-python-app-engine-app-using-the-translate-api-getting-an-error-of-impo
Inbar Rose,python multithreading wait till all threads finished,"Viewed 280,894 times",170,https://stackoverflow.com/questions/11968689/python-multithreading-wait-till-all-threads-finished
erogol,How to convert list of numpy arrays into single numpy array?,"Viewed 245,323 times",171,https://stackoverflow.com/questions/27516849/how-to-convert-list-of-numpy-arrays-into-single-numpy-array
Rabarberski,Execution of Python code with -m option or not,"Viewed 127,868 times",171,https://stackoverflow.com/questions/22241420/execution-of-python-code-with-m-option-or-not
Dharman,demystify Flask app.secret_key,"Viewed 90,030 times",171,https://stackoverflow.com/questions/22463939/demystify-flask-app-secret-key
Peter Mortensen,How can I put multiple statements in one line?,"Viewed 293,111 times",171,https://stackoverflow.com/questions/6167127/how-can-i-put-multiple-statements-in-one-line
Ciro Santilli Путлер Капут 六四事,Accessing items in an collections.OrderedDict by index,"Viewed 220,869 times",171,https://stackoverflow.com/questions/10058140/accessing-items-in-an-collections-ordereddict-by-index
bumpkin,Pandas DataFrame to List of Lists,"Viewed 193,674 times",171,https://stackoverflow.com/questions/28006793/pandas-dataframe-to-list-of-lists
MWB,"How do I avoid the ""self.x = x; self.y = y; self.z = z"" pattern in __init__?","Viewed 15,015 times",171,https://stackoverflow.com/questions/35190877/how-do-i-avoid-the-self-x-x-self-y-y-self-z-z-pattern-in-init
Peter Mortensen,"Iterate a list as pair (current, next) in Python","Viewed 67,163 times",171,https://stackoverflow.com/questions/5434891/iterate-a-list-as-pair-current-next-in-python
hochl,How to get the concrete class name as a string? [duplicate],"Viewed 134,822 times",171,https://stackoverflow.com/questions/521502/how-to-get-the-concrete-class-name-as-a-string
Eric,Python __call__ special method practical example,"Viewed 134,798 times",171,https://stackoverflow.com/questions/5824881/python-call-special-method-practical-example
Ciro Santilli Путлер Капут 六四事,How to sort a list of strings numerically?,"Viewed 347,188 times",168,https://stackoverflow.com/questions/3426108/how-to-sort-a-list-of-strings-numerically
linkmaster03,Cleanest and most Pythonic way to get tomorrow's date?,"Viewed 113,442 times",168,https://stackoverflow.com/questions/1506901/cleanest-and-most-pythonic-way-to-get-tomorrows-date
Asaf Hanish,Python: Convert timedelta to int in a dataframe,"Viewed 356,065 times",168,https://stackoverflow.com/questions/25646200/python-convert-timedelta-to-int-in-a-dataframe
0xCursor,Conda command is not recognized on Windows 10,"Viewed 383,900 times",168,https://stackoverflow.com/questions/44597662/conda-command-is-not-recognized-on-windows-10
BSMP,Making an API call in Python with an API that requires a bearer token,"Viewed 292,226 times",168,https://stackoverflow.com/questions/29931671/making-an-api-call-in-python-with-an-api-that-requires-a-bearer-token
Student,"n-grams in python, four, five, six grams?","Viewed 230,020 times",168,https://stackoverflow.com/questions/17531684/n-grams-in-python-four-five-six-grams
Community,Display an image with Python,"Viewed 701,913 times",168,https://stackoverflow.com/questions/35286540/display-an-image-with-python
Community,Add SUM of values of two LISTS into new LIST,"Viewed 317,536 times",168,https://stackoverflow.com/questions/14050824/add-sum-of-values-of-two-lists-into-new-list
martineau,append multiple values for one key in a dictionary [duplicate],"Viewed 733,440 times",168,https://stackoverflow.com/questions/3199171/append-multiple-values-for-one-key-in-a-dictionary
Ted Smith,python design patterns [closed],"Viewed 90,770 times",169,https://stackoverflow.com/questions/606448/python-design-patterns
Vivz,How to convert an array of strings to an array of floats in numpy?,"Viewed 448,229 times",169,https://stackoverflow.com/questions/3877209/how-to-convert-an-array-of-strings-to-an-array-of-floats-in-numpy
BFTM,Numpy: Divide each row by a vector element,"Viewed 136,685 times",169,https://stackoverflow.com/questions/19602187/numpy-divide-each-row-by-a-vector-element
iliketocode,How do I run a Python script from C#?,"Viewed 365,629 times",169,https://stackoverflow.com/questions/11779143/how-do-i-run-a-python-script-from-c
biswajit,certificate verify failed: unable to get local issuer certificate,"Viewed 259,623 times",169,https://stackoverflow.com/questions/52805115/certificate-verify-failed-unable-to-get-local-issuer-certificate
robintw,Add single element to array in numpy,"Viewed 440,396 times",169,https://stackoverflow.com/questions/7332841/add-single-element-to-array-in-numpy
Mark Amery,"In Python, how does one catch warnings as if they were exceptions?","Viewed 116,245 times",169,https://stackoverflow.com/questions/5644836/in-python-how-does-one-catch-warnings-as-if-they-were-exceptions
EMP,"""Inner exception"" (with traceback) in Python?","Viewed 51,032 times",165,https://stackoverflow.com/questions/1350671/inner-exception-with-traceback-in-python
martineau,How to convert a string of bytes into an int?,"Viewed 330,279 times",165,https://stackoverflow.com/questions/444591/how-to-convert-a-string-of-bytes-into-an-int
Alex Gaynor,Can't connect to local MySQL server through socket '/tmp/mysql.sock,"Viewed 373,810 times",165,https://stackoverflow.com/questions/16325607/cant-connect-to-local-mysql-server-through-socket-tmp-mysql-sock
ROMANIA_engineer,How does the class_weight parameter in scikit-learn work?,"Viewed 153,578 times",166,https://stackoverflow.com/questions/30972029/how-does-the-class-weight-parameter-in-scikit-learn-work
Papop Lekhapanyaporn,"Python, Unicode, and the Windows console","Viewed 122,379 times",166,https://stackoverflow.com/questions/5419/python-unicode-and-the-windows-console
Sardathrion - against SE abuse,Mocking a class: Mock() or patch()?,"Viewed 163,371 times",166,https://stackoverflow.com/questions/8180769/mocking-a-class-mock-or-patch
Alex Riley,Difference between numpy dot() and Python 3.5+ matrix multiplication @,"Viewed 155,699 times",166,https://stackoverflow.com/questions/34142485/difference-between-numpy-dot-and-python-3-5-matrix-multiplication
Sridhar Ratnakumar,How do I detect whether sys.stdout is attached to terminal or not? [duplicate],"Viewed 40,739 times",166,https://stackoverflow.com/questions/1077113/how-do-i-detect-whether-sys-stdout-is-attached-to-terminal-or-not
pmav99,Can I use __init__.py to define global variables?,"Viewed 114,060 times",166,https://stackoverflow.com/questions/1383239/can-i-use-init-py-to-define-global-variables
Community,How to get the PATH environment-variable separator in Python?,"Viewed 93,138 times",166,https://stackoverflow.com/questions/1499019/how-to-get-the-path-environment-variable-separator-in-python
martineau,What exactly is file.flush() doing?,"Viewed 122,519 times",166,https://stackoverflow.com/questions/7127075/what-exactly-is-file-flush-doing
Cœur,Use .corr to get the correlation between two columns,"Viewed 455,158 times",166,https://stackoverflow.com/questions/42579908/use-corr-to-get-the-correlation-between-two-columns
Community,How do I run a Python program in the Command Prompt in Windows 7?,"Viewed 874,985 times",166,https://stackoverflow.com/questions/4621255/how-do-i-run-a-python-program-in-the-command-prompt-in-windows-7
Ronan Boiteau,Assert a function/method was not called using Mock,"Viewed 142,670 times",166,https://stackoverflow.com/questions/12187122/assert-a-function-method-was-not-called-using-mock
martineau,How to run functions in parallel?,"Viewed 299,606 times",166,https://stackoverflow.com/questions/7207309/how-to-run-functions-in-parallel
