answer_by,ques,views,vote,weblink
suci,Creating an empty list in Python,"Viewed 717,839 times",253,https://stackoverflow.com/questions/2972212/creating-an-empty-list-in-python
bukzor,SQLAlchemy: print the actual query,"Viewed 193,536 times",253,https://stackoverflow.com/questions/5631078/sqlalchemy-print-the-actual-query
Neuron,Override Python's 'in' operator?,"Viewed 93,173 times",253,https://stackoverflow.com/questions/2217001/override-pythons-in-operator
Anton Protopopov,How to add header row to a pandas DataFrame,"Viewed 659,725 times",253,https://stackoverflow.com/questions/34091877/how-to-add-header-row-to-a-pandas-dataframe
Peter Mortensen,xlrd.biffh.XLRDError: Excel xlsx file; not supported [duplicate],"Viewed 433,448 times",253,https://stackoverflow.com/questions/65254535/xlrd-biffh-xlrderror-excel-xlsx-file-not-supported
Trilarion,How to declare array of zeros in python (or an array of a certain size) [duplicate],"Viewed 585,784 times",253,https://stackoverflow.com/questions/4056768/how-to-declare-array-of-zeros-in-python-or-an-array-of-a-certain-size
jargalan,How to increment datetime by custom months in python without using library [duplicate],"Viewed 379,872 times",253,https://stackoverflow.com/questions/4130922/how-to-increment-datetime-by-custom-months-in-python-without-using-library
Aryaman,How do I upgrade to Python 3.6 with conda?,"Viewed 532,622 times",254,https://stackoverflow.com/questions/41535881/how-do-i-upgrade-to-python-3-6-with-conda
Alex Waygood,Python type hinting without cyclic imports,"Viewed 67,773 times",254,https://stackoverflow.com/questions/39740632/python-type-hinting-without-cyclic-imports
Xantium,Clear terminal in Python [duplicate],"Viewed 527,938 times",247,https://stackoverflow.com/questions/2084508/clear-terminal-in-python
wjandrea,Clear variable in python,"Viewed 708,646 times",247,https://stackoverflow.com/questions/8237647/clear-variable-in-python
VirtualScooter,Permutations between two lists of unequal length,"Viewed 272,305 times",247,https://stackoverflow.com/questions/12935194/permutations-between-two-lists-of-unequal-length
Community,"What's the proper way to install pip, virtualenv, and distribute for Python?","Viewed 156,145 times",248,https://stackoverflow.com/questions/4324558/whats-the-proper-way-to-install-pip-virtualenv-and-distribute-for-python
Tommy Herbert,Is a Python dictionary an example of a hash table?,"Viewed 231,509 times",248,https://stackoverflow.com/questions/114830/is-a-python-dictionary-an-example-of-a-hash-table
Sabito 錆兎 stands with Ukraine,How does Django's nested Meta class work?,"Viewed 145,140 times",248,https://stackoverflow.com/questions/10344197/how-does-djangos-nested-meta-class-work
Neuron,live output from subprocess command,"Viewed 214,419 times",248,https://stackoverflow.com/questions/18421757/live-output-from-subprocess-command
Claude,Asyncio.gather vs asyncio.wait,"Viewed 227,674 times",248,https://stackoverflow.com/questions/42231161/asyncio-gather-vs-asyncio-wait
alex,"Is Python interpreted, or compiled, or both?","Viewed 216,973 times",248,https://stackoverflow.com/questions/6889747/is-python-interpreted-or-compiled-or-both
BrechtDeMan,List of lists into numpy array,"Viewed 365,129 times",248,https://stackoverflow.com/questions/10346336/list-of-lists-into-numpy-array
dreftymac,Jinja2 shorthand conditional,"Viewed 149,222 times",248,https://stackoverflow.com/questions/14214942/jinja2-shorthand-conditional
Kai - Kazuya Ito,Django values_list vs values,"Viewed 255,560 times",248,https://stackoverflow.com/questions/37205793/django-values-list-vs-values
Venkatachalam,Take multiple lists into dataframe,"Viewed 435,272 times",248,https://stackoverflow.com/questions/30522724/take-multiple-lists-into-dataframe
Mike Samuel,How do I load a file into the python console?,"Viewed 276,856 times",248,https://stackoverflow.com/questions/5280178/how-do-i-load-a-file-into-the-python-console
Cleb,How to filter rows containing a string pattern from a Pandas dataframe [duplicate],"Viewed 545,794 times",248,https://stackoverflow.com/questions/27975069/how-to-filter-rows-containing-a-string-pattern-from-a-pandas-dataframe
robintw,Reduce left and right margins in matplotlib plot,"Viewed 319,464 times",248,https://stackoverflow.com/questions/4042192/reduce-left-and-right-margins-in-matplotlib-plot
Antti Haapala -- Слава Україні,How do I keep Python print from adding newlines or spaces? [duplicate],"Viewed 302,694 times",242,https://stackoverflow.com/questions/255147/how-do-i-keep-python-print-from-adding-newlines-or-spaces
alichaudry,Save classifier to disk in scikit-learn,"Viewed 149,744 times",242,https://stackoverflow.com/questions/10592605/save-classifier-to-disk-in-scikit-learn
Andy Lester,Why does Python's hash of infinity have the digits of π?,"Viewed 28,991 times",243,https://stackoverflow.com/questions/56227419/why-does-pythons-hash-of-infinity-have-the-digits-of-%cf%80
Peter Mortensen,Executing multi-line statements in the one-line command-line,"Viewed 192,209 times",243,https://stackoverflow.com/questions/2043453/executing-multi-line-statements-in-the-one-line-command-line
Alex Waygood,Type hinting a collection of a specified type,"Viewed 172,859 times",243,https://stackoverflow.com/questions/24853923/type-hinting-a-collection-of-a-specified-type
bad_coder,How to show all columns' names on a large pandas dataframe?,"Viewed 497,430 times",243,https://stackoverflow.com/questions/49188960/how-to-show-all-columns-names-on-a-large-pandas-dataframe
the,Get the current git hash in a Python script,"Viewed 118,675 times",243,https://stackoverflow.com/questions/14989858/get-the-current-git-hash-in-a-python-script
SultanOrazbayev,How can I map True/False to 1/0 in a Pandas DataFrame?,"Viewed 282,484 times",243,https://stackoverflow.com/questions/17383094/how-can-i-map-true-false-to-1-0-in-a-pandas-dataframe
dreftymac,How do I copy a string to the clipboard?,"Viewed 207,205 times",243,https://stackoverflow.com/questions/579687/how-do-i-copy-a-string-to-the-clipboard
Jacob Marble,Skip first entry in for loop in python?,"Viewed 289,414 times",243,https://stackoverflow.com/questions/10079216/skip-first-entry-in-for-loop-in-python
desertnaut,ImportError: No module named sklearn.cross_validation,"Viewed 429,409 times",243,https://stackoverflow.com/questions/30667525/importerror-no-module-named-sklearn-cross-validation
ATOzTOA,Can I serve multiple clients using just Flask app.run() as standalone?,"Viewed 236,917 times",244,https://stackoverflow.com/questions/14814201/can-i-serve-multiple-clients-using-just-flask-app-run-as-standalone
Mr_and_Mrs_D,How to construct a set out of list items in python?,"Viewed 533,924 times",244,https://stackoverflow.com/questions/15768757/how-to-construct-a-set-out-of-list-items-in-python
Eric Leschinski,I'm getting Key error in python,"Viewed 940,255 times",244,https://stackoverflow.com/questions/10116518/im-getting-key-error-in-python
ndmeiri,Remove the first character of a string,"Viewed 514,486 times",244,https://stackoverflow.com/questions/4945548/remove-the-first-character-of-a-string
Janusz,Initialise a list to a specific length in Python [duplicate],"Viewed 316,871 times",244,https://stackoverflow.com/questions/983699/initialise-a-list-to-a-specific-length-in-python
codeforester,How do I print the key-value pairs of a dictionary in python,"Viewed 980,067 times",244,https://stackoverflow.com/questions/26660654/how-do-i-print-the-key-value-pairs-of-a-dictionary-in-python
cs95,Concatenate a list of pandas dataframes together,"Viewed 286,270 times",238,https://stackoverflow.com/questions/32444138/concatenate-a-list-of-pandas-dataframes-together
Jonathon Reinhart,sqlalchemy unique across multiple columns,"Viewed 122,974 times",238,https://stackoverflow.com/questions/10059345/sqlalchemy-unique-across-multiple-columns
Braiam,How do I convert this list of dictionaries to a csv file?,"Viewed 202,505 times",238,https://stackoverflow.com/questions/3086973/how-do-i-convert-this-list-of-dictionaries-to-a-csv-file
denfromufa,Pandas: Looking up the list of sheets in an excel file,"Viewed 264,488 times",238,https://stackoverflow.com/questions/17977540/pandas-looking-up-the-list-of-sheets-in-an-excel-file
Peter Mortensen,Set up Python simpleHTTPserver on Windows [duplicate],"Viewed 262,600 times",238,https://stackoverflow.com/questions/17351016/set-up-python-simplehttpserver-on-windows
Peter Mortensen,What is the proper way to comment functions in Python?,"Viewed 244,685 times",238,https://stackoverflow.com/questions/2357230/what-is-the-proper-way-to-comment-functions-in-python
Mark Graph,Changing a specific column name in pandas DataFrame [duplicate],"Viewed 369,467 times",238,https://stackoverflow.com/questions/20868394/changing-a-specific-column-name-in-pandas-dataframe
Null,Cannot install Lxml on Mac OS X 10.9,"Viewed 96,717 times",238,https://stackoverflow.com/questions/19548011/cannot-install-lxml-on-mac-os-x-10-9
Mateusz Piotrowski,How do I pass a method as a parameter in Python,"Viewed 263,869 times",239,https://stackoverflow.com/questions/706721/how-do-i-pass-a-method-as-a-parameter-in-python
feetwet,How to loop over grouped Pandas dataframe?,"Viewed 336,311 times",239,https://stackoverflow.com/questions/27405483/how-to-loop-over-grouped-pandas-dataframe
Wrigglenite,Build the full path filename in Python,"Viewed 344,213 times",239,https://stackoverflow.com/questions/7132861/build-the-full-path-filename-in-python
martineau,Formatting floats without trailing zeros,"Viewed 168,199 times",239,https://stackoverflow.com/questions/2440692/formatting-floats-without-trailing-zeros
Mantas Vidutis,Python Sets vs Lists,"Viewed 208,030 times",239,https://stackoverflow.com/questions/2831212/python-sets-vs-lists
stites,"Search for ""does-not-contain"" on a DataFrame in pandas","Viewed 287,872 times",239,https://stackoverflow.com/questions/17097643/search-for-does-not-contain-on-a-dataframe-in-pandas
SuperStormer,ImportError: No module named 'django.core.urlresolvers',"Viewed 219,650 times",239,https://stackoverflow.com/questions/43139081/importerror-no-module-named-django-core-urlresolvers
nbro,How do I check if there are duplicates in a flat list?,"Viewed 323,794 times",239,https://stackoverflow.com/questions/1541797/how-do-i-check-if-there-are-duplicates-in-a-flat-list
Mark Rotteveel,"django MultiValueDictKeyError error, how do I deal with it","Viewed 366,129 times",233,https://stackoverflow.com/questions/5895588/django-multivaluedictkeyerror-error-how-do-i-deal-with-it
martineau,Replacing blank values (white space) with NaN in pandas,"Viewed 416,486 times",233,https://stackoverflow.com/questions/13445241/replacing-blank-values-white-space-with-nan-in-pandas
martineau,Different ways of clearing lists,"Viewed 375,839 times",233,https://stackoverflow.com/questions/850795/different-ways-of-clearing-lists
Woody1193,Merge PDF files,"Viewed 231,440 times",233,https://stackoverflow.com/questions/3444645/merge-pdf-files
martineau,How to delete last item in list?,"Viewed 430,461 times",233,https://stackoverflow.com/questions/18169965/how-to-delete-last-item-in-list
Gino Mempin,"""ERROR:root:code for hash md5 was not found"" when using any hg mercurial commands","Viewed 120,008 times",233,https://stackoverflow.com/questions/59269208/errorrootcode-for-hash-md5-was-not-found-when-using-any-hg-mercurial-command
xiaoman,"What is the difference between pyenv, virtualenv, anaconda?","Viewed 118,398 times",234,https://stackoverflow.com/questions/38217545/what-is-the-difference-between-pyenv-virtualenv-anaconda
Trenton McKinney,How to install both Python 2.x and Python 3.x in Windows,"Viewed 243,005 times",234,https://stackoverflow.com/questions/3809314/how-to-install-both-python-2-x-and-python-3-x-in-windows
Peter Mortensen,How to check if a Python module exists without importing it,"Viewed 231,220 times",234,https://stackoverflow.com/questions/14050281/how-to-check-if-a-python-module-exists-without-importing-it
Peter Mortensen,Why is the use of len(SEQUENCE) in condition values considered incorrect by Pylint?,"Viewed 93,408 times",234,https://stackoverflow.com/questions/43121340/why-is-the-use-of-lensequence-in-condition-values-considered-incorrect-by-pyli
NelsonGon,warning about too many open figures,"Viewed 169,740 times",234,https://stackoverflow.com/questions/21884271/warning-about-too-many-open-figures
Peter Mortensen,Why can't Python's raw string literals end with a single backslash?,"Viewed 103,848 times",234,https://stackoverflow.com/questions/647769/why-cant-pythons-raw-string-literals-end-with-a-single-backslash
dreftymac,How do I get python's pprint to return a string instead of printing?,"Viewed 82,449 times",234,https://stackoverflow.com/questions/521532/how-do-i-get-pythons-pprint-to-return-a-string-instead-of-printing
nbro,Is it possible to set a number to NaN or infinity?,"Viewed 357,757 times",234,https://stackoverflow.com/questions/5438745/is-it-possible-to-set-a-number-to-nan-or-infinity
smci,How to add multiple columns to pandas dataframe in one assignment?,"Viewed 353,577 times",234,https://stackoverflow.com/questions/39050539/how-to-add-multiple-columns-to-pandas-dataframe-in-one-assignment
Martin Thoma,How do I format a date in Jinja2?,"Viewed 233,649 times",234,https://stackoverflow.com/questions/4830535/how-do-i-format-a-date-in-jinja2
p_sutherland,Is there a library function for Root mean square error (RMSE) in python?,"Viewed 418,540 times",229,https://stackoverflow.com/questions/17197492/is-there-a-library-function-for-root-mean-square-error-rmse-in-python
Kudu,Pinging servers in Python,"Viewed 704,247 times",229,https://stackoverflow.com/questions/2953462/pinging-servers-in-python
Null,pass **kwargs argument to another function with **kwargs,"Viewed 149,025 times",230,https://stackoverflow.com/questions/9867562/pass-kwargs-argument-to-another-function-with-kwargs
sophros,Is there a difference between using a dict literal and a dict constructor?,"Viewed 155,106 times",230,https://stackoverflow.com/questions/6610606/is-there-a-difference-between-using-a-dict-literal-and-a-dict-constructor
That1Guy,How to get exit code when using Python subprocess communicate method?,"Viewed 328,444 times",230,https://stackoverflow.com/questions/5631624/how-to-get-exit-code-when-using-python-subprocess-communicate-method
smci,Why does Python code use len() function instead of a length method?,"Viewed 185,408 times",230,https://stackoverflow.com/questions/237128/why-does-python-code-use-len-function-instead-of-a-length-method
Michael Petrotta,How to install python modules without root access?,"Viewed 255,278 times",230,https://stackoverflow.com/questions/7465445/how-to-install-python-modules-without-root-access
Eli Bendersky,Python function attributes - uses and abuses [closed],"Viewed 157,798 times",230,https://stackoverflow.com/questions/338101/python-function-attributes-uses-and-abuses
Ciro Santilli Путлер Капут 六四事,How to send an email with Python?,"Viewed 425,748 times",230,https://stackoverflow.com/questions/6270782/how-to-send-an-email-with-python
alexgolec,How to modify list entries during for loop?,"Viewed 352,814 times",230,https://stackoverflow.com/questions/4081217/how-to-modify-list-entries-during-for-loop
martineau,Dictionary: Get list of values for list of keys,"Viewed 344,517 times",230,https://stackoverflow.com/questions/18453566/dictionary-get-list-of-values-for-list-of-keys
DavidRR,Logging uncaught exceptions in Python,"Viewed 78,654 times",230,https://stackoverflow.com/questions/6234405/logging-uncaught-exceptions-in-python
user2276896,How do I get current URL in Selenium Webdriver 2 Python?,"Viewed 299,382 times",230,https://stackoverflow.com/questions/15985339/how-do-i-get-current-url-in-selenium-webdriver-2-python
3cheesewheel,django test app error - Got an error creating the test database: permission denied to create database,"Viewed 101,242 times",230,https://stackoverflow.com/questions/14186055/django-test-app-error-got-an-error-creating-the-test-database-permission-deni
Artemis,Proxies with Python 'Requests' module,"Viewed 514,616 times",230,https://stackoverflow.com/questions/8287628/proxies-with-python-requests-module
Austin Cummings,Create a .csv file with values from a Python list,"Viewed 810,907 times",230,https://stackoverflow.com/questions/2084069/create-a-csv-file-with-values-from-a-python-list
Max Li,plot a circle with pyplot,"Viewed 534,719 times",225,https://stackoverflow.com/questions/9215658/plot-a-circle-with-pyplot
Georgy,Drop all duplicate rows across multiple columns in Python Pandas,"Viewed 466,675 times",225,https://stackoverflow.com/questions/23667369/drop-all-duplicate-rows-across-multiple-columns-in-python-pandas
DocZerø,How to calculate the time interval between two time strings,"Viewed 549,125 times",225,https://stackoverflow.com/questions/3096953/how-to-calculate-the-time-interval-between-two-time-strings
Bhargav Rao,What is the syntax to insert one list into another list in python?,"Viewed 306,735 times",225,https://stackoverflow.com/questions/3748063/what-is-the-syntax-to-insert-one-list-into-another-list-in-python
Jason Orendorff,Is there any way to do HTTP PUT in python,"Viewed 176,682 times",225,https://stackoverflow.com/questions/111945/is-there-any-way-to-do-http-put-in-python
kaya3,How to ignore deprecation warnings in Python,"Viewed 261,626 times",225,https://stackoverflow.com/questions/879173/how-to-ignore-deprecation-warnings-in-python
saroele,What is the difference between a pandas Series and a single-column DataFrame?,"Viewed 136,809 times",226,https://stackoverflow.com/questions/26047209/what-is-the-difference-between-a-pandas-series-and-a-single-column-dataframe
Community,"A clean, lightweight alternative to Python's twisted? [closed]","Viewed 58,072 times",226,https://stackoverflow.com/questions/1824418/a-clean-lightweight-alternative-to-pythons-twisted
Michael Currie,"In Python, what happens when you import inside of a function? [duplicate]","Viewed 148,835 times",226,https://stackoverflow.com/questions/3095071/in-python-what-happens-when-you-import-inside-of-a-function
codeforester,"In Python, how do I indicate I'm overriding a method?","Viewed 120,303 times",226,https://stackoverflow.com/questions/1167617/in-python-how-do-i-indicate-im-overriding-a-method
David Jones,How can I specify working directory for popen,"Viewed 215,581 times",226,https://stackoverflow.com/questions/1685157/how-can-i-specify-working-directory-for-popen
naught101,How to make an immutable object in Python?,"Viewed 114,673 times",226,https://stackoverflow.com/questions/4828080/how-to-make-an-immutable-object-in-python
anon01,Apply vs transform on a group object,"Viewed 153,955 times",226,https://stackoverflow.com/questions/27517425/apply-vs-transform-on-a-group-object
bucky,Writing a Python list of lists to a csv file,"Viewed 413,337 times",226,https://stackoverflow.com/questions/14037540/writing-a-python-list-of-lists-to-a-csv-file
matanc1,Python - Get path of root project structure,"Viewed 369,950 times",226,https://stackoverflow.com/questions/25389095/python-get-path-of-root-project-structure
John Kugelman,List of unique dictionaries,"Viewed 175,901 times",226,https://stackoverflow.com/questions/11092511/list-of-unique-dictionaries
Ricky McMaster,"SQLAlchemy: engine, connection and session difference","Viewed 108,089 times",222,https://stackoverflow.com/questions/34322471/sqlalchemy-engine-connection-and-session-difference
Trenton McKinney,How to add hovering annotations to a plot,"Viewed 202,459 times",222,https://stackoverflow.com/questions/7908636/how-to-add-hovering-annotations-to-a-plot
Ciro Santilli Путлер Капут 六四事,Purpose of #!/usr/bin/python3 shebang,"Viewed 279,465 times",222,https://stackoverflow.com/questions/7670303/purpose-of-usr-bin-python3-shebang
pydanny,"Which is better in python, del or delattr?","Viewed 107,372 times",222,https://stackoverflow.com/questions/1120927/which-is-better-in-python-del-or-delattr
Mark Chackerian,Identifying the dependency relationship for python packages installed with pip,"Viewed 112,613 times",222,https://stackoverflow.com/questions/9232568/identifying-the-dependency-relationship-for-python-packages-installed-with-pip
Eric O Lebigot,How to do a scatter plot with empty circles in Python?,"Viewed 345,259 times",222,https://stackoverflow.com/questions/4143502/how-to-do-a-scatter-plot-with-empty-circles-in-python
Mark Amery,Case insensitive replace,"Viewed 127,558 times",222,https://stackoverflow.com/questions/919056/case-insensitive-replace
Adam,How can I time a code segment for testing performance with Pythons timeit?,"Viewed 286,830 times",222,https://stackoverflow.com/questions/2866380/how-can-i-time-a-code-segment-for-testing-performance-with-pythons-timeit
Abdullah Khawer,How to choose an AWS profile when using boto3 to connect to CloudFront,"Viewed 171,533 times",222,https://stackoverflow.com/questions/33378422/how-to-choose-an-aws-profile-when-using-boto3-to-connect-to-cloudfront
FObersteiner,How to add hours to current time in python,"Viewed 335,943 times",222,https://stackoverflow.com/questions/13685201/how-to-add-hours-to-current-time-in-python
H. Pauwelyn,matplotlib error - no module named tkinter,"Viewed 286,527 times",222,https://stackoverflow.com/questions/36327134/matplotlib-error-no-module-named-tkinter
sanyassh,Automatic creation date for Django model form objects?,"Viewed 166,498 times",222,https://stackoverflow.com/questions/3429878/automatic-creation-date-for-django-model-form-objects
martineau,What is the best way to implement nested dictionaries?,"Viewed 117,009 times",222,https://stackoverflow.com/questions/635483/what-is-the-best-way-to-implement-nested-dictionaries
wrongusername,How to strip all whitespace from string,"Viewed 394,416 times",222,https://stackoverflow.com/questions/3739909/how-to-strip-all-whitespace-from-string
Community,"Python Flask, how to set content type","Viewed 222,609 times",222,https://stackoverflow.com/questions/11773348/python-flask-how-to-set-content-type
UserAG,"""RuntimeError: Make sure the Graphviz executables are on your system's path"" after installing Graphviz 2.38","Viewed 328,754 times",222,https://stackoverflow.com/questions/35064304/runtimeerror-make-sure-the-graphviz-executables-are-on-your-systems-path-aft
smci,Efficient way to apply multiple filters to pandas DataFrame or Series,"Viewed 409,751 times",218,https://stackoverflow.com/questions/13611065/efficient-way-to-apply-multiple-filters-to-pandas-dataframe-or-series
Skippy le Grand Gourou,How to replace NaNs by preceding or next values in pandas DataFrame?,"Viewed 190,297 times",218,https://stackoverflow.com/questions/27905295/how-to-replace-nans-by-preceding-or-next-values-in-pandas-dataframe
martineau,What exactly does the .join() method do?,"Viewed 579,044 times",218,https://stackoverflow.com/questions/1876191/what-exactly-does-the-join-method-do
Gattster,How can I break up this long line in Python?,"Viewed 296,918 times",218,https://stackoverflow.com/questions/2058925/how-can-i-break-up-this-long-line-in-python
Mel,How to get first element in a list of tuples?,"Viewed 308,432 times",218,https://stackoverflow.com/questions/12142133/how-to-get-first-element-in-a-list-of-tuples
ivanleoncz,"What's the purpose of ""send"" function on Python generators?","Viewed 107,277 times",218,https://stackoverflow.com/questions/19302530/whats-the-purpose-of-send-function-on-python-generators
Pang,Removing all non-numeric characters from string in Python,"Viewed 227,696 times",218,https://stackoverflow.com/questions/1249388/removing-all-non-numeric-characters-from-string-in-python
Aran-Fey,AttributeError: 'datetime' module has no attribute 'strptime',"Viewed 344,996 times",218,https://stackoverflow.com/questions/19480028/attributeerror-datetime-module-has-no-attribute-strptime
Pika Supports Ukraine,Find column whose name contains a specific string,"Viewed 359,736 times",218,https://stackoverflow.com/questions/21285380/find-column-whose-name-contains-a-specific-string
user,How to dynamically load a Python class,"Viewed 186,880 times",218,https://stackoverflow.com/questions/547829/how-to-dynamically-load-a-python-class
nbro,What is the '@=' symbol for in Python?,"Viewed 75,119 times",219,https://stackoverflow.com/questions/27385633/what-is-the-symbol-for-in-python
Community,What is the inverse function of zip in python? [duplicate],"Viewed 76,621 times",219,https://stackoverflow.com/questions/13635032/what-is-the-inverse-function-of-zip-in-python
unutbu,Numpy - add row to array,"Viewed 632,667 times",219,https://stackoverflow.com/questions/3881453/numpy-add-row-to-array
Ethan Furman,How do I use method overloading in Python?,"Viewed 253,027 times",219,https://stackoverflow.com/questions/10202938/how-do-i-use-method-overloading-in-python
User,"TypeError: a bytes-like object is required, not 'str' in python and CSV","Viewed 245,939 times",219,https://stackoverflow.com/questions/34283178/typeerror-a-bytes-like-object-is-required-not-str-in-python-and-csv
Roman Pekar,python dataframe pandas drop column using int,"Viewed 369,523 times",219,https://stackoverflow.com/questions/20297317/python-dataframe-pandas-drop-column-using-int
Falko,How to merge a transparent png image with another image using PIL,"Viewed 184,699 times",214,https://stackoverflow.com/questions/5324647/how-to-merge-a-transparent-png-image-with-another-image-using-pil
darthbith,'Conda' is not recognized as internal or external command,"Viewed 547,565 times",214,https://stackoverflow.com/questions/44515769/conda-is-not-recognized-as-internal-or-external-command
