answer_by,ques,views,vote,weblink
Nathaniel Jones,Python setup.py develop vs install,"Viewed 172,202 times",410,https://stackoverflow.com/questions/19048732/python-setup-py-develop-vs-install
piRSquared,"Converting between datetime, Timestamp and datetime64","Viewed 658,337 times",411,https://stackoverflow.com/questions/13703720/converting-between-datetime-timestamp-and-datetime64
theonlygusti,Python list sort in descending order,"Viewed 757,778 times",411,https://stackoverflow.com/questions/4183506/python-list-sort-in-descending-order
martineau,Threading pool similar to the multiprocessing Pool?,"Viewed 410,763 times",411,https://stackoverflow.com/questions/3033952/threading-pool-similar-to-the-multiprocessing-pool
Mark Storer,Python module for converting PDF to text [closed],"Viewed 426,496 times",412,https://stackoverflow.com/questions/25665/python-module-for-converting-pdf-to-text
poke,Rename multiple files in a directory in Python,"Viewed 624,623 times",412,https://stackoverflow.com/questions/2759067/rename-multiple-files-in-a-directory-in-python
Peter Mortensen,How to draw vertical lines on a given plot,"Viewed 710,873 times",412,https://stackoverflow.com/questions/24988448/how-to-draw-vertical-lines-on-a-given-plot
Martijn Pieters,How to write a Python module/package?,"Viewed 417,107 times",413,https://stackoverflow.com/questions/15746675/how-to-write-a-python-module-package
Mateen Ulhaq,How do I create an empty array and then append to it in NumPy?,"Viewed 1,292,032 times",414,https://stackoverflow.com/questions/568962/how-do-i-create-an-empty-array-and-then-append-to-it-in-numpy
lmiguelvargasf,How to print to console in pytest?,"Viewed 276,022 times",414,https://stackoverflow.com/questions/24617397/how-to-print-to-console-in-pytest
Peter Mortensen,"Error ""filename.whl is not a supported wheel on this platform""","Viewed 685,876 times",414,https://stackoverflow.com/questions/28568070/error-filename-whl-is-not-a-supported-wheel-on-this-platform
dreftymac,"How to use a dot ""."" to access members of dictionary?","Viewed 246,794 times",414,https://stackoverflow.com/questions/2352181/how-to-use-a-dot-to-access-members-of-dictionary
Mazdak,Convert Pandas Column to DateTime,"Viewed 864,485 times",415,https://stackoverflow.com/questions/26763344/convert-pandas-column-to-datetime
Peter Mortensen,How to add an extra column to a NumPy array,"Viewed 707,404 times",415,https://stackoverflow.com/questions/8486294/how-to-add-an-extra-column-to-a-numpy-array
Kayathiri,What is the difference between 'SAME' and 'VALID' padding in tf.nn.max_pool of tensorflow?,"Viewed 361,655 times",415,https://stackoverflow.com/questions/37674306/what-is-the-difference-between-same-and-valid-padding-in-tf-nn-max-pool-of-t
T. Zengerink,What are the differences between numpy arrays and matrices? Which one should I use?,"Viewed 182,704 times",416,https://stackoverflow.com/questions/4151128/what-are-the-differences-between-numpy-arrays-and-matrices-which-one-should-i-u
Dharman,How to get last items of a list in Python?,"Viewed 532,684 times",393,https://stackoverflow.com/questions/646644/how-to-get-last-items-of-a-list-in-python
Cajunluke,Assign output of os.system to a variable and prevent it from being displayed on the screen [duplicate],"Viewed 641,726 times",394,https://stackoverflow.com/questions/3503879/assign-output-of-os-system-to-a-variable-and-prevent-it-from-being-displayed-on
samoz,Is a Python list guaranteed to have its elements stay in the order they are inserted in?,"Viewed 243,664 times",394,https://stackoverflow.com/questions/13694034/is-a-python-list-guaranteed-to-have-its-elements-stay-in-the-order-they-are-inse
Matthew Schinckel,Best way to format integer as string with leading zeros? [duplicate],"Viewed 526,138 times",394,https://stackoverflow.com/questions/733454/best-way-to-format-integer-as-string-with-leading-zeros
amicitas,Why does datetime.datetime.utcnow() not contain timezone information?,"Viewed 237,446 times",395,https://stackoverflow.com/questions/2331592/why-does-datetime-datetime-utcnow-not-contain-timezone-information
DigviJay Patil,"How can I convert a character to a integer in Python, and viceversa?","Viewed 635,710 times",395,https://stackoverflow.com/questions/704152/how-can-i-convert-a-character-to-a-integer-in-python-and-viceversa
Ronan Boiteau,Format timedelta to string,"Viewed 446,096 times",395,https://stackoverflow.com/questions/538666/format-timedelta-to-string
Martin Thoma,How can I create an object and add attributes to it?,"Viewed 469,650 times",395,https://stackoverflow.com/questions/2827623/how-can-i-create-an-object-and-add-attributes-to-it
gsamaras,Converting NumPy array into Python List structure?,"Viewed 569,200 times",396,https://stackoverflow.com/questions/1966207/converting-numpy-array-into-python-list-structure
wjandrea,Does reading an entire file leave the file handle open?,"Viewed 481,881 times",396,https://stackoverflow.com/questions/7409780/does-reading-an-entire-file-leave-the-file-handle-open
Community,Understanding Keras LSTMs,"Viewed 72,912 times",397,https://stackoverflow.com/questions/38714959/understanding-keras-lstms
Trenton McKinney,How to add title to subplots in Matplotlib,"Viewed 729,282 times",397,https://stackoverflow.com/questions/25239933/how-to-add-title-to-subplots-in-matplotlib
vinzee,"Python 3: ImportError ""No Module named Setuptools""","Viewed 807,761 times",397,https://stackoverflow.com/questions/14426491/python-3-importerror-no-module-named-setuptools
Tomerikoo,Bare asterisk in function arguments?,"Viewed 69,008 times",398,https://stackoverflow.com/questions/14301967/bare-asterisk-in-function-arguments
Michael Wang,Why do I get AttributeError: 'NoneType' object has no attribute 'something'?,"Viewed 1,404,709 times",398,https://stackoverflow.com/questions/8949252/why-do-i-get-attributeerror-nonetype-object-has-no-attribute-something
Salvador Dali,Can a variable number of arguments be passed to a function?,"Viewed 415,604 times",398,https://stackoverflow.com/questions/919680/can-a-variable-number-of-arguments-be-passed-to-a-function
martineau,Turn a string into a valid filename?,"Viewed 235,422 times",381,https://stackoverflow.com/questions/295135/turn-a-string-into-a-valid-filename
Simon Hughes,Delete a dictionary item if the key exists [duplicate],"Viewed 225,847 times",381,https://stackoverflow.com/questions/15411107/delete-a-dictionary-item-if-the-key-exists
otmezger,python: how to identify if a variable is an array or a scalar,"Viewed 474,046 times",381,https://stackoverflow.com/questions/16807011/python-how-to-identify-if-a-variable-is-an-array-or-a-scalar
user2357112,How do you find the first key in a dictionary?,"Viewed 604,720 times",381,https://stackoverflow.com/questions/30362391/how-do-you-find-the-first-key-in-a-dictionary
Mark Amery,Python 3 ImportError: No module named 'ConfigParser',"Viewed 587,407 times",381,https://stackoverflow.com/questions/14087598/python-3-importerror-no-module-named-configparser
Mateen Ulhaq,How do I check if PyTorch is using the GPU?,"Viewed 605,314 times",383,https://stackoverflow.com/questions/48152674/how-do-i-check-if-pytorch-is-using-the-gpu
Martin Thoma,Cost of len() function,"Viewed 120,187 times",384,https://stackoverflow.com/questions/1115313/cost-of-len-function
Hossein,Cannot find module cv2 when using OpenCV,"Viewed 1,559,958 times",384,https://stackoverflow.com/questions/19876079/cannot-find-module-cv2-when-using-opencv
Peter Mortensen,Unicode (UTF-8) reading and writing to files in Python,"Viewed 942,024 times",384,https://stackoverflow.com/questions/491921/unicode-utf-8-reading-and-writing-to-files-in-python
Peter Mortensen,Python strings and integer concatenation [duplicate],"Viewed 753,794 times",385,https://stackoverflow.com/questions/2847386/python-strings-and-integer-concatenation
Georgy,Creating a Pandas DataFrame from a Numpy array: How do I specify the index column and column headers?,"Viewed 1,088,649 times",385,https://stackoverflow.com/questions/20763012/creating-a-pandas-dataframe-from-a-numpy-array-how-do-i-specify-the-index-colum
martineau,Print current call stack from a method in code,"Viewed 193,767 times",385,https://stackoverflow.com/questions/1156023/print-current-call-stack-from-a-method-in-code
Anand Tripathi,Difference between filter and filter_by in SQLAlchemy,"Viewed 228,942 times",385,https://stackoverflow.com/questions/2128505/difference-between-filter-and-filter-by-in-sqlalchemy
Remi Guan,Why doesn't os.path.join() work in this case?,"Viewed 595,700 times",385,https://stackoverflow.com/questions/1945920/why-doesnt-os-path-join-work-in-this-case
Bhargav Rao,How can I check if a key exists in a dictionary? [duplicate],"Viewed 643,789 times",385,https://stackoverflow.com/questions/3845362/how-can-i-check-if-a-key-exists-in-a-dictionary
ead,What is the most efficient way to loop through dataframes with pandas?,"Viewed 623,423 times",385,https://stackoverflow.com/questions/7837722/what-is-the-most-efficient-way-to-loop-through-dataframes-with-pandas
Jonathan Leffler,What is :: (double colon) in Python when subscripting sequences?,"Viewed 301,159 times",366,https://stackoverflow.com/questions/3453085/what-is-double-colon-in-python-when-subscripting-sequences
Trenton McKinney,How to invert the x or y axis,"Viewed 462,390 times",366,https://stackoverflow.com/questions/2051744/how-to-invert-the-x-or-y-axis
transilvlad,UnicodeDecodeError: 'utf8' codec can't decode byte 0x9c,"Viewed 1,050,164 times",367,https://stackoverflow.com/questions/12468179/unicodedecodeerror-utf8-codec-cant-decode-byte-0x9c
martineau,Using logging in multiple modules,"Viewed 270,676 times",367,https://stackoverflow.com/questions/15727420/using-logging-in-multiple-modules
ideasman42,How to start a background process in Python?,"Viewed 558,676 times",368,https://stackoverflow.com/questions/1196074/how-to-start-a-background-process-in-python
dreftymac,How to find list intersection?,"Viewed 405,670 times",368,https://stackoverflow.com/questions/3697432/how-to-find-list-intersection
allyourcode,Is it bad to have my virtualenv directory inside my git repository?,"Viewed 153,923 times",369,https://stackoverflow.com/questions/6590688/is-it-bad-to-have-my-virtualenv-directory-inside-my-git-repository
Radical Edward,Pandas index column title or name,"Viewed 819,674 times",369,https://stackoverflow.com/questions/18022845/pandas-index-column-title-or-name
halfer,How to find which version of TensorFlow is installed in my system?,"Viewed 1,121,550 times",369,https://stackoverflow.com/questions/38549253/how-to-find-which-version-of-tensorflow-is-installed-in-my-system
martineau,"multiprocessing.Pool: When to use apply, apply_async or map?","Viewed 344,258 times",370,https://stackoverflow.com/questions/8533318/multiprocessing-pool-when-to-use-apply-apply-async-or-map
martineau,How do I define a function with optional arguments?,"Viewed 786,160 times",370,https://stackoverflow.com/questions/9539921/how-do-i-define-a-function-with-optional-arguments
Peter Mortensen,How to check whether a file is empty or not,"Viewed 377,773 times",370,https://stackoverflow.com/questions/2507808/how-to-check-whether-a-file-is-empty-or-not
Peter Mortensen,Print multiple arguments in Python,"Viewed 1,106,299 times",370,https://stackoverflow.com/questions/15286401/print-multiple-arguments-in-python
Community,Concatenating two one-dimensional NumPy arrays,"Viewed 463,861 times",371,https://stackoverflow.com/questions/9236926/concatenating-two-one-dimensional-numpy-arrays
Community,Showing the stack trace from a running Python application,"Viewed 156,437 times",371,https://stackoverflow.com/questions/132058/showing-the-stack-trace-from-a-running-python-application
Stevoisiak,How do I compare version numbers in Python?,"Viewed 180,257 times",371,https://stackoverflow.com/questions/11887762/how-do-i-compare-version-numbers-in-python
Timbus Calin,How to prevent tensorflow from allocating the totality of a GPU memory?,"Viewed 242,210 times",354,https://stackoverflow.com/questions/34199233/how-to-prevent-tensorflow-from-allocating-the-totality-of-a-gpu-memory
Nathan,Add Variables to Tuple,"Viewed 736,431 times",354,https://stackoverflow.com/questions/1380860/add-variables-to-tuple
Peter Mortensen,How do I disable a Pylint warning?,"Viewed 416,932 times",354,https://stackoverflow.com/questions/4341746/how-do-i-disable-a-pylint-warning
funnydman,How to convert SQLAlchemy row object to a Python dict?,"Viewed 368,382 times",354,https://stackoverflow.com/questions/1958219/how-to-convert-sqlalchemy-row-object-to-a-python-dict
Mat,Ignore python multiple return value,"Viewed 265,107 times",354,https://stackoverflow.com/questions/431866/ignore-python-multiple-return-value
smci,"How to use filter, map, and reduce in Python 3","Viewed 327,114 times",355,https://stackoverflow.com/questions/13638898/how-to-use-filter-map-and-reduce-in-python-3
Mateen Ulhaq,Pythonic way to combine for-loop and if-statement,"Viewed 578,518 times",355,https://stackoverflow.com/questions/6981717/pythonic-way-to-combine-for-loop-and-if-statement
Pratik Deoghare,Lazy Method for Reading Big File in Python?,"Viewed 318,867 times",355,https://stackoverflow.com/questions/519633/lazy-method-for-reading-big-file-in-python
Alex Waygood,Type annotations for *args and **kwargs,"Viewed 148,345 times",356,https://stackoverflow.com/questions/37031928/type-annotations-for-args-and-kwargs
AlSub,How to use string.replace() in python 3.x,"Viewed 556,468 times",356,https://stackoverflow.com/questions/9452108/how-to-use-string-replace-in-python-3-x
wovano,"""inconsistent use of tabs and spaces in indentation""","Viewed 1,363,775 times",356,https://stackoverflow.com/questions/5685406/inconsistent-use-of-tabs-and-spaces-in-indentation
simhumileco,"What is the fastest way to send 100,000 HTTP requests in Python?","Viewed 288,264 times",357,https://stackoverflow.com/questions/2632520/what-is-the-fastest-way-to-send-100-000-http-requests-in-python
Morix Dev,Converting datetime.date to UTC timestamp in Python,"Viewed 742,699 times",357,https://stackoverflow.com/questions/8777753/converting-datetime-date-to-utc-timestamp-in-python
martineau,Best way to find the intersection of multiple sets?,"Viewed 208,452 times",357,https://stackoverflow.com/questions/2541752/best-way-to-find-the-intersection-of-multiple-sets
Mykola Zotko,pandas get rows which are NOT in other dataframe,"Viewed 374,848 times",357,https://stackoverflow.com/questions/28901683/pandas-get-rows-which-are-not-in-other-dataframe
unutbu,Print in one line dynamically,"Viewed 665,197 times",357,https://stackoverflow.com/questions/3249524/print-in-one-line-dynamically
kmario23,What is the difference between ndarray and array in numpy?,"Viewed 152,421 times",342,https://stackoverflow.com/questions/15879315/what-is-the-difference-between-ndarray-and-array-in-numpy
Riley,How to check if a variable is a dictionary in Python?,"Viewed 455,787 times",342,https://stackoverflow.com/questions/25231989/how-to-check-if-a-variable-is-a-dictionary-in-python
Josh Correia,"How do I get the object if it exists, or None if it does not exist in Django?","Viewed 293,291 times",342,https://stackoverflow.com/questions/3090302/how-do-i-get-the-object-if-it-exists-or-none-if-it-does-not-exist-in-django
Stephen Ostermiller,Strip HTML from strings in Python,"Viewed 314,110 times",342,https://stackoverflow.com/questions/753052/strip-html-from-strings-in-python
osiris,"What SOAP client libraries exist for Python, and where is the documentation for them? [closed]","Viewed 248,149 times",343,https://stackoverflow.com/questions/206154/what-soap-client-libraries-exist-for-python-and-where-is-the-documentation-for
Community,"super() raises ""TypeError: must be type, not classobj"" for new-style class","Viewed 142,795 times",343,https://stackoverflow.com/questions/9698614/super-raises-typeerror-must-be-type-not-classobj-for-new-style-class
Martijn Pieters,"Python ""raise from"" usage","Viewed 122,243 times",344,https://stackoverflow.com/questions/24752395/python-raise-from-usage
nye17,Most efficient way to reverse a numpy array,"Viewed 523,286 times",344,https://stackoverflow.com/questions/6771428/most-efficient-way-to-reverse-a-numpy-array
Oli,What is PEP8's E128: continuation line under-indented for visual indent?,"Viewed 290,191 times",344,https://stackoverflow.com/questions/15435811/what-is-pep8s-e128-continuation-line-under-indented-for-visual-indent
Martijn Pieters,Splitting on last delimiter in Python string?,"Viewed 281,591 times",344,https://stackoverflow.com/questions/15012228/splitting-on-last-delimiter-in-python-string
mkrieger1,How to split a list based on a condition?,"Viewed 249,590 times",344,https://stackoverflow.com/questions/949098/how-to-split-a-list-based-on-a-condition
Adriaan,How do I check which version of NumPy I'm using?,"Viewed 521,648 times",344,https://stackoverflow.com/questions/1520234/how-do-i-check-which-version-of-numpy-im-using
Peter Mortensen,How do I find an element that contains specific text in Selenium WebDriver (Python)?,"Viewed 754,022 times",345,https://stackoverflow.com/questions/12323403/how-do-i-find-an-element-that-contains-specific-text-in-selenium-webdriver-pyth
Wolf,Python function global variables?,"Viewed 739,928 times",345,https://stackoverflow.com/questions/10588317/python-function-global-variables
Michael Hoffman,List of zeros in python [duplicate],"Viewed 682,831 times",345,https://stackoverflow.com/questions/8528178/list-of-zeros-in-python
Boris Verkhovskiy,Convert a list with strings all to lowercase or uppercase,"Viewed 675,703 times",345,https://stackoverflow.com/questions/1801668/convert-a-list-with-strings-all-to-lowercase-or-uppercase
Mateen Ulhaq,Frequency counts for unique values in a NumPy array,"Viewed 431,912 times",333,https://stackoverflow.com/questions/10741346/frequency-counts-for-unique-values-in-a-numpy-array
MattDMo,UnicodeDecodeError: 'utf8' codec can't decode byte 0xa5 in position 0: invalid start byte,"Viewed 1,387,913 times",333,https://stackoverflow.com/questions/22216076/unicodedecodeerror-utf8-codec-cant-decode-byte-0xa5-in-position-0-invalid-s
Phillip,json.dumps vs flask.jsonify,"Viewed 393,508 times",334,https://stackoverflow.com/questions/7907596/json-dumps-vs-flask-jsonify
Peter Mortensen,How do you generate dynamic (parameterized) unit tests in Python?,"Viewed 164,339 times",334,https://stackoverflow.com/questions/32899/how-do-you-generate-dynamic-parameterized-unit-tests-in-python
loopbackbee,How do I split a multi-line string into multiple lines?,"Viewed 510,998 times",334,https://stackoverflow.com/questions/172439/how-do-i-split-a-multi-line-string-into-multiple-lines
smci,Using Pandas to pd.read_excel() for multiple worksheets of the same workbook,"Viewed 633,015 times",334,https://stackoverflow.com/questions/26521266/using-pandas-to-pd-read-excel-for-multiple-worksheets-of-the-same-workbook
General Grievance,Auto reloading python Flask app upon code changes,"Viewed 256,487 times",334,https://stackoverflow.com/questions/16344756/auto-reloading-python-flask-app-upon-code-changes
Alex Riley,Convert a Pandas DataFrame to a dictionary,"Viewed 560,650 times",335,https://stackoverflow.com/questions/26716616/convert-a-pandas-dataframe-to-a-dictionary
D.Rosado,"How to send a ""multipart/form-data"" with requests in python?","Viewed 488,555 times",335,https://stackoverflow.com/questions/12385179/how-to-send-a-multipart-form-data-with-requests-in-python
mkrieger1,Getting rid of \n when using .readlines() [duplicate],"Viewed 475,806 times",335,https://stackoverflow.com/questions/15233340/getting-rid-of-n-when-using-readlines
Mateen Ulhaq,Get loop count inside a for-loop,"Viewed 525,790 times",335,https://stackoverflow.com/questions/3162271/get-loop-count-inside-a-for-loop
Alex Waygood,"How to specify ""nullable"" return type with type hints","Viewed 98,476 times",336,https://stackoverflow.com/questions/39429526/how-to-specify-nullable-return-type-with-type-hints
Oli,"Convert a timedelta to days, hours and minutes","Viewed 524,805 times",336,https://stackoverflow.com/questions/2119472/convert-a-timedelta-to-days-hours-and-minutes
Serenity,InsecurePlatformWarning: A true SSLContext object is not available. This prevents urllib3 from configuring SSL appropriately [duplicate],"Viewed 323,682 times",336,https://stackoverflow.com/questions/29134512/insecureplatformwarning-a-true-sslcontext-object-is-not-available-this-prevent
mkrieger1,Transpose list of lists,"Viewed 310,811 times",336,https://stackoverflow.com/questions/6473679/transpose-list-of-lists
Mateen Ulhaq,Dropping infinite values from dataframes in pandas?,"Viewed 447,033 times",336,https://stackoverflow.com/questions/17477979/dropping-infinite-values-from-dataframes-in-pandas
Asclepius,"Argparse: Required arguments listed under ""optional arguments""?","Viewed 270,925 times",327,https://stackoverflow.com/questions/24180527/argparse-required-arguments-listed-under-optional-arguments
cs95,Add column to dataframe with constant value,"Viewed 583,403 times",327,https://stackoverflow.com/questions/29517072/add-column-to-dataframe-with-constant-value
John Rotenstein,Listing contents of a bucket with boto3,"Viewed 549,623 times",327,https://stackoverflow.com/questions/30249069/listing-contents-of-a-bucket-with-boto3
martineau,Best way to replace multiple characters in a string?,"Viewed 661,127 times",327,https://stackoverflow.com/questions/3411771/best-way-to-replace-multiple-characters-in-a-string
evtoh,How to initialize a dict with keys from a list and empty value in Python?,"Viewed 403,231 times",327,https://stackoverflow.com/questions/2241891/how-to-initialize-a-dict-with-keys-from-a-list-and-empty-value-in-python
Ciro Santilli Путлер Капут 六四事,How to execute a Python script from the Django shell?,"Viewed 290,653 times",327,https://stackoverflow.com/questions/16853649/how-to-execute-a-python-script-from-the-django-shell
Peter Mortensen,Generate 'n' unique random numbers within a range [duplicate],"Viewed 514,028 times",328,https://stackoverflow.com/questions/22842289/generate-n-unique-random-numbers-within-a-range
Community,Why isn't Python very good for functional programming? [closed],"Viewed 129,028 times",328,https://stackoverflow.com/questions/1017621/why-isnt-python-very-good-for-functional-programming
HappyPy,how do I insert a column at a specific column index in pandas?,"Viewed 440,719 times",328,https://stackoverflow.com/questions/18674064/how-do-i-insert-a-column-at-a-specific-column-index-in-pandas
peterh,correct way to define class variables in Python [duplicate],"Viewed 421,623 times",328,https://stackoverflow.com/questions/9056957/correct-way-to-define-class-variables-in-python
martineau,How to sum all the values in a dictionary?,"Viewed 450,068 times",328,https://stackoverflow.com/questions/4880960/how-to-sum-all-the-values-in-a-dictionary
wasabigeek,Python not working in the command line of git bash,"Viewed 227,968 times",328,https://stackoverflow.com/questions/32597209/python-not-working-in-the-command-line-of-git-bash
Henry Ecker,I can't install python-ldap,"Viewed 304,750 times",328,https://stackoverflow.com/questions/4768446/i-cant-install-python-ldap
sshashank124,How do I pass a string into subprocess.Popen (using the stdin argument)?,"Viewed 389,394 times",329,https://stackoverflow.com/questions/163542/how-do-i-pass-a-string-into-subprocess-popen-using-the-stdin-argument
Marco,Check if two unordered lists are equal [duplicate],"Viewed 473,320 times",329,https://stackoverflow.com/questions/9623114/check-if-two-unordered-lists-are-equal
Peter Mortensen,"Error ""Microsoft Visual C++ 14.0 is required (Unable to find vcvarsall.bat)""","Viewed 1,011,190 times",329,https://stackoverflow.com/questions/29846087/error-microsoft-visual-c-14-0-is-required-unable-to-find-vcvarsall-bat
"
        12 revs, 7 users 36%",Send HTML emails with Python,"Viewed 466,480 times",318,https://stackoverflow.com/questions/882712/send-html-emails-with-python
Adam Nelson,Python truncate a long string,"Viewed 378,259 times",318,https://stackoverflow.com/questions/2872512/python-truncate-a-long-string
malana,Why doesn't Python have a sign function?,"Viewed 220,374 times",319,https://stackoverflow.com/questions/1986152/why-doesnt-python-have-a-sign-function
martineau,Why do I need 'b' to encode a string with Base64?,"Viewed 500,957 times",319,https://stackoverflow.com/questions/8908287/why-do-i-need-b-to-encode-a-string-with-base64
Tom Zych,Is Python strongly typed?,"Viewed 183,450 times",319,https://stackoverflow.com/questions/11328920/is-python-strongly-typed
Mark Amery,Redirecting to URL in Flask,"Viewed 575,413 times",319,https://stackoverflow.com/questions/14343812/redirecting-to-url-in-flask
Kai - Kazuya Ito,How to activate virtualenv in Linux?,"Viewed 864,003 times",319,https://stackoverflow.com/questions/14604699/how-to-activate-virtualenv-in-linux
codeforester,Normal arguments vs. keyword arguments,"Viewed 280,682 times",319,https://stackoverflow.com/questions/1419046/normal-arguments-vs-keyword-arguments
Josh Correia,"What is the purpose of ""pip install --user ...""?","Viewed 433,313 times",320,https://stackoverflow.com/questions/42988977/what-is-the-purpose-of-pip-install-user
Aran-Fey,How to open a file for both reading and writing?,"Viewed 383,040 times",320,https://stackoverflow.com/questions/6648493/how-to-open-a-file-for-both-reading-and-writing
Velimir Mlaker,How do I plot in real-time in a while loop using matplotlib?,"Viewed 729,298 times",320,https://stackoverflow.com/questions/11874767/how-do-i-plot-in-real-time-in-a-while-loop-using-matplotlib
davidism,Set variable in jinja,"Viewed 395,161 times",320,https://stackoverflow.com/questions/3727045/set-variable-in-jinja
