answer_by,ques,views,vote,weblink
sneeu,How to fix 'Object arrays cannot be loaded when allow_pickle=False' for imdb.load_data() function?,"Viewed 224,982 times",148,https://stackoverflow.com/questions/55890813/how-to-fix-object-arrays-cannot-be-loaded-when-allow-pickle-false-for-imdb-loa
Community,How do I design a class in Python?,"Viewed 71,318 times",148,https://stackoverflow.com/questions/4203163/how-do-i-design-a-class-in-python
Stefan Pochmann,What causes [*a] to overallocate?,"Viewed 5,836 times",149,https://stackoverflow.com/questions/60549865/what-causes-a-to-overallocate
kwinkunks,Read file data without saving it in Flask,"Viewed 163,968 times",149,https://stackoverflow.com/questions/20015550/read-file-data-without-saving-it-in-flask
Neil G,Is the list of Python reserved words and builtins available in a library?,"Viewed 44,588 times",149,https://stackoverflow.com/questions/22864221/is-the-list-of-python-reserved-words-and-builtins-available-in-a-library
Cœur,Better to 'try' something and catch the exception or test if it's possible first to avoid an exception?,"Viewed 47,165 times",149,https://stackoverflow.com/questions/7604636/better-to-try-something-and-catch-the-exception-or-test-if-its-possible-first
norok2,NumPy: function for simultaneous max() and min(),"Viewed 93,655 times",149,https://stackoverflow.com/questions/12200580/numpy-function-for-simultaneous-max-and-min
codeforester,Split string based on regex,"Viewed 208,206 times",149,https://stackoverflow.com/questions/13209288/split-string-based-on-regex
Stanpol,Multiple linear regression in Python,"Viewed 222,308 times",147,https://stackoverflow.com/questions/11479064/multiple-linear-regression-in-python
nbro,How to know the version of pip itself,"Viewed 397,664 times",147,https://stackoverflow.com/questions/26378344/how-to-know-the-version-of-pip-itself
Nicolas Gervais,Could not load dynamic library 'cudart64_101.dll' on tensorflow CPU-only installation,"Viewed 374,838 times",147,https://stackoverflow.com/questions/59823283/could-not-load-dynamic-library-cudart64-101-dll-on-tensorflow-cpu-only-install
BenDundee,Append column to pandas dataframe,"Viewed 425,331 times",147,https://stackoverflow.com/questions/20602947/append-column-to-pandas-dataframe
Cœur,Split string using a newline delimiter with Python [duplicate],"Viewed 257,786 times",147,https://stackoverflow.com/questions/22042948/split-string-using-a-newline-delimiter-with-python
feetwet,Find the max of two or more columns with pandas,"Viewed 207,991 times",147,https://stackoverflow.com/questions/12169170/find-the-max-of-two-or-more-columns-with-pandas
sans,Python executable not finding libpython shared library,"Viewed 247,907 times",147,https://stackoverflow.com/questions/7880454/python-executable-not-finding-libpython-shared-library
Aran-Fey,List of tuples to dictionary [duplicate],"Viewed 131,358 times",147,https://stackoverflow.com/questions/6522446/list-of-tuples-to-dictionary
Ian Mackinnon,Some built-in to pad a list in python,"Viewed 85,512 times",147,https://stackoverflow.com/questions/3438756/some-built-in-to-pad-a-list-in-python
GG.,Subprocess changing directory,"Viewed 190,198 times",147,https://stackoverflow.com/questions/21406887/subprocess-changing-directory
tmdavison,Hide tick label values but keep axis labels,"Viewed 284,773 times",147,https://stackoverflow.com/questions/37039685/hide-tick-label-values-but-keep-axis-labels
seralouk,Can anyone explain me StandardScaler?,"Viewed 239,630 times",147,https://stackoverflow.com/questions/40758562/can-anyone-explain-me-standardscaler
normanius,Move column by name to front of table in pandas,"Viewed 156,090 times",147,https://stackoverflow.com/questions/25122099/move-column-by-name-to-front-of-table-in-pandas
nichoio,"Pip - Fatal error in launcher: Unable to create process using '""'","Viewed 435,745 times",147,https://stackoverflow.com/questions/37220055/pip-fatal-error-in-launcher-unable-to-create-process-using
MERose,How to frame two for loops in list comprehension python,"Viewed 174,926 times",147,https://stackoverflow.com/questions/18551458/how-to-frame-two-for-loops-in-list-comprehension-python
John Kugelman,How to determine the language of a piece of text?,"Viewed 130,738 times",147,https://stackoverflow.com/questions/39142778/how-to-determine-the-language-of-a-piece-of-text
LSchueler,"How to set 'auto' for upper limit, but keep a fixed lower limit with matplotlib.pyplot","Viewed 96,655 times",146,https://stackoverflow.com/questions/11744990/how-to-set-auto-for-upper-limit-but-keep-a-fixed-lower-limit-with-matplotlib
Greg,Django - how to create a file and save it to a model's FileField?,"Viewed 129,153 times",146,https://stackoverflow.com/questions/7514964/django-how-to-create-a-file-and-save-it-to-a-models-filefield
hatmatrix,Assign pandas dataframe column dtypes,"Viewed 239,067 times",146,https://stackoverflow.com/questions/21197774/assign-pandas-dataframe-column-dtypes
Glenn Maynard,Why do we need tuples in Python (or any immutable data type)?,"Viewed 46,177 times",146,https://stackoverflow.com/questions/2174124/why-do-we-need-tuples-in-python-or-any-immutable-data-type
MikeiLL,What exactly is Python multiprocessing Module's .join() Method Doing?,"Viewed 121,070 times",146,https://stackoverflow.com/questions/25391025/what-exactly-is-python-multiprocessing-modules-join-method-doing
alok,Is there a recommended format for multi-line imports?,"Viewed 47,620 times",146,https://stackoverflow.com/questions/14376900/is-there-a-recommended-format-for-multi-line-imports
conny,Is there a python equivalent of Ruby's 'rvm'?,"Viewed 45,422 times",146,https://stackoverflow.com/questions/2812471/is-there-a-python-equivalent-of-rubys-rvm
martineau,Why doesn't calling a string method do anything unless its output is assigned?,"Viewed 103,640 times",146,https://stackoverflow.com/questions/9189172/why-doesnt-calling-a-string-method-do-anything-unless-its-output-is-assigned
Jean-François Corbett,How to implement __iter__(self) for a container object (Python),"Viewed 150,700 times",146,https://stackoverflow.com/questions/4019971/how-to-implement-iter-self-for-a-container-object-python
Brian,Reading a binary file with python,"Viewed 374,150 times",146,https://stackoverflow.com/questions/8710456/reading-a-binary-file-with-python
Random Nerd,"What does 'wb' mean in this code, using Python?","Viewed 365,016 times",146,https://stackoverflow.com/questions/2665866/what-does-wb-mean-in-this-code-using-python
glglgl,"class method generates ""TypeError: ... got multiple values for keyword argument ...""","Viewed 154,958 times",146,https://stackoverflow.com/questions/18950054/class-method-generates-typeerror-got-multiple-values-for-keyword-argument
Ruofeng,figure of imshow() is too small,"Viewed 270,979 times",146,https://stackoverflow.com/questions/10540929/figure-of-imshow-is-too-small
Mike,Make sure only a single instance of a program is running,"Viewed 94,159 times",146,https://stackoverflow.com/questions/380870/make-sure-only-a-single-instance-of-a-program-is-running
Nathan Fellman,Pythonic way of checking if a condition holds for any element of a list,"Viewed 138,189 times",146,https://stackoverflow.com/questions/1342601/pythonic-way-of-checking-if-a-condition-holds-for-any-element-of-a-list
martineau,Explicitly select items from a list or tuple,"Viewed 399,883 times",146,https://stackoverflow.com/questions/6632188/explicitly-select-items-from-a-list-or-tuple
Guillaume Chevalier,What is exactly sklearn.pipeline.Pipeline?,"Viewed 96,986 times",144,https://stackoverflow.com/questions/33091376/what-is-exactly-sklearn-pipeline-pipeline
Mike,Convert numpy array to tuple,"Viewed 254,857 times",144,https://stackoverflow.com/questions/10016352/convert-numpy-array-to-tuple
Cleb,Python pandas insert list into a cell,"Viewed 195,612 times",144,https://stackoverflow.com/questions/26483254/python-pandas-insert-list-into-a-cell
Jakub Kukul,How to make two plots side-by-side using Python?,"Viewed 283,124 times",144,https://stackoverflow.com/questions/42818361/how-to-make-two-plots-side-by-side-using-python
Serjik,Django FileField with upload_to determined at runtime,"Viewed 68,780 times",144,https://stackoverflow.com/questions/1190697/django-filefield-with-upload-to-determined-at-runtime
Peter Mortensen,Inserting a Python datetime.datetime object into MySQL,"Viewed 292,747 times",144,https://stackoverflow.com/questions/1136437/inserting-a-python-datetime-datetime-object-into-mysql
dshri,How to get one value at a time from a generator function in Python?,"Viewed 101,685 times",144,https://stackoverflow.com/questions/2419770/how-to-get-one-value-at-a-time-from-a-generator-function-in-python
JJJ,Add column with number of days between dates in DataFrame pandas,"Viewed 258,846 times",144,https://stackoverflow.com/questions/22132525/add-column-with-number-of-days-between-dates-in-dataframe-pandas
Elliot Cameron,A python class that acts like dict,"Viewed 200,301 times",144,https://stackoverflow.com/questions/4014621/a-python-class-that-acts-like-dict
Paolo,gunicorn autoreload on source change,"Viewed 69,204 times",144,https://stackoverflow.com/questions/12773763/gunicorn-autoreload-on-source-change
Trilarion,How to get the index of a maximum element in a NumPy array along one axis,"Viewed 261,716 times",144,https://stackoverflow.com/questions/5469286/how-to-get-the-index-of-a-maximum-element-in-a-numpy-array-along-one-axis
Georgy,Existence of mutable named tuple in Python?,"Viewed 55,138 times",144,https://stackoverflow.com/questions/29290359/existence-of-mutable-named-tuple-in-python
dreftymac,"In Python, how can you load YAML mappings as OrderedDicts?","Viewed 75,350 times",144,https://stackoverflow.com/questions/5121931/in-python-how-can-you-load-yaml-mappings-as-ordereddicts
hata,Multiprocessing causes Python to crash and gives an error may have been in progress in another thread when fork() was called,"Viewed 53,935 times",144,https://stackoverflow.com/questions/50168647/multiprocessing-causes-python-to-crash-and-gives-an-error-may-have-been-in-progr
CCovey,How do I install Python packages on Windows?,"Viewed 497,700 times",144,https://stackoverflow.com/questions/1449494/how-do-i-install-python-packages-on-windows
dreftymac,Python: how to print range a-z?,"Viewed 328,504 times",144,https://stackoverflow.com/questions/3190122/python-how-to-print-range-a-z
shayaan,How Big can a Python List Get?,"Viewed 208,344 times",142,https://stackoverflow.com/questions/855191/how-big-can-a-python-list-get
Damian Pavlica,How are POST and GET variables handled in Python?,"Viewed 199,743 times",142,https://stackoverflow.com/questions/464040/how-are-post-and-get-variables-handled-in-python
Aran-Fey,Getting user input [duplicate],"Viewed 412,878 times",142,https://stackoverflow.com/questions/3345202/getting-user-input
user1911092,Pandas Merge - How to avoid duplicating columns,"Viewed 207,948 times",142,https://stackoverflow.com/questions/19125091/pandas-merge-how-to-avoid-duplicating-columns
Martijn Pieters,Log all requests from the python-requests module,"Viewed 152,039 times",142,https://stackoverflow.com/questions/16337511/log-all-requests-from-the-python-requests-module
Mr_and_Mrs_D,Printing tuple with string formatting in Python,"Viewed 267,488 times",142,https://stackoverflow.com/questions/1455602/printing-tuple-with-string-formatting-in-python
Kai - Kazuya Ito,Login credentials not working with Gmail SMTP,"Viewed 249,803 times",142,https://stackoverflow.com/questions/16512592/login-credentials-not-working-with-gmail-smtp
Gonçalo Peres,Drop rows containing empty cells from a pandas DataFrame,"Viewed 416,500 times",142,https://stackoverflow.com/questions/29314033/drop-rows-containing-empty-cells-from-a-pandas-dataframe
Troll,Adding Python to PATH on Windows,"Viewed 540,291 times",142,https://stackoverflow.com/questions/6318156/adding-python-to-path-on-windows
kalehmann,Authentication plugin 'caching_sha2_password' is not supported,"Viewed 204,473 times",142,https://stackoverflow.com/questions/50557234/authentication-plugin-caching-sha2-password-is-not-supported
cs95,How to convert column with dtype as object to string in Pandas Dataframe [duplicate],"Viewed 475,912 times",143,https://stackoverflow.com/questions/33957720/how-to-convert-column-with-dtype-as-object-to-string-in-pandas-dataframe
Jean-François Corbett,Copy file or directories recursively in Python,"Viewed 195,259 times",143,https://stackoverflow.com/questions/1994488/copy-file-or-directories-recursively-in-python
vaughnkoch,Easiest way to rename a model using Django/South?,"Viewed 30,552 times",143,https://stackoverflow.com/questions/2862979/easiest-way-to-rename-a-model-using-django-south
Peter Mortensen,Are global variables thread-safe in Flask? How do I share data between requests?,"Viewed 66,642 times",143,https://stackoverflow.com/questions/32815451/are-global-variables-thread-safe-in-flask-how-do-i-share-data-between-requests
Boris Verkhovskiy,ValueError : I/O operation on closed file,"Viewed 488,260 times",143,https://stackoverflow.com/questions/18952716/valueerror-i-o-operation-on-closed-file
tkokoszka,Dictionary vs Object - which is more efficient and why?,"Viewed 69,469 times",143,https://stackoverflow.com/questions/1336791/dictionary-vs-object-which-is-more-efficient-and-why
ivanleoncz,log messages appearing twice with Python Logging,"Viewed 86,177 times",141,https://stackoverflow.com/questions/6729268/log-messages-appearing-twice-with-python-logging
BlackVegetable,print memory address of Python variable [duplicate],"Viewed 228,084 times",141,https://stackoverflow.com/questions/16408472/print-memory-address-of-python-variable
Eric Leschinski,unbound method f() must be called with fibo_ instance as first argument (got classobj instance instead),"Viewed 305,292 times",141,https://stackoverflow.com/questions/4473184/unbound-method-f-must-be-called-with-fibo-instance-as-first-argument-got-cla
Bhargav Rao,How to convert a date string to different format [duplicate],"Viewed 336,198 times",141,https://stackoverflow.com/questions/14524322/how-to-convert-a-date-string-to-different-format
Trenton McKinney,Calculate Time Difference Between Two Pandas Columns in Hours and Minutes,"Viewed 326,701 times",141,https://stackoverflow.com/questions/22923775/calculate-time-difference-between-two-pandas-columns-in-hours-and-minutes
bluevoxel,How to save and load numpy.array() data properly?,"Viewed 281,340 times",141,https://stackoverflow.com/questions/28439701/how-to-save-and-load-numpy-array-data-properly
Community,How to trace the path in a Breadth-First Search?,"Viewed 180,089 times",141,https://stackoverflow.com/questions/8922060/how-to-trace-the-path-in-a-breadth-first-search
Tomerikoo,How to generate a random number with a specific amount of digits?,"Viewed 231,724 times",141,https://stackoverflow.com/questions/2673385/how-to-generate-a-random-number-with-a-specific-amount-of-digits
ottodidakt,Is it possible to have multiple statements in a python lambda expression?,"Viewed 194,125 times",141,https://stackoverflow.com/questions/862412/is-it-possible-to-have-multiple-statements-in-a-python-lambda-expression
Will Vousden,Haversine Formula in Python (Bearing and Distance between two GPS points),"Viewed 193,298 times",141,https://stackoverflow.com/questions/4913349/haversine-formula-in-python-bearing-and-distance-between-two-gps-points
David Cullen,Permission denied when activating venv,"Viewed 132,946 times",141,https://stackoverflow.com/questions/45554864/permission-denied-when-activating-venv
vkv-onfire,How to find the size or shape of a DataFrame in PySpark?,"Viewed 277,915 times",141,https://stackoverflow.com/questions/39652767/how-to-find-the-size-or-shape-of-a-dataframe-in-pyspark
ROMANIA_engineer,How to get instance variables in Python?,"Viewed 182,795 times",141,https://stackoverflow.com/questions/109087/how-to-get-instance-variables-in-python
nbro,How to install pip for Python 3 on Mac OS X?,"Viewed 300,254 times",141,https://stackoverflow.com/questions/20082935/how-to-install-pip-for-python-3-on-mac-os-x
ivanleoncz,How to schedule a function to run every hour on Flask?,"Viewed 189,955 times",141,https://stackoverflow.com/questions/21214270/how-to-schedule-a-function-to-run-every-hour-on-flask
John Fouhy,Efficiently updating database using SQLAlchemy ORM,"Viewed 218,116 times",141,https://stackoverflow.com/questions/270879/efficiently-updating-database-using-sqlalchemy-orm
Community,Reducing Django Memory Usage. Low hanging fruit?,"Viewed 20,372 times",140,https://stackoverflow.com/questions/487224/reducing-django-memory-usage-low-hanging-fruit
Martijn Pieters,Difference between python3 and python3m executables,"Viewed 37,342 times",140,https://stackoverflow.com/questions/16675865/difference-between-python3-and-python3m-executables
Machavity,Right way to initialize an OrderedDict using its constructor such that it retains order of initial data?,"Viewed 95,656 times",140,https://stackoverflow.com/questions/25480089/right-way-to-initialize-an-ordereddict-using-its-constructor-such-that-it-retain
Peter Mortensen,What is %timeit in Python?,"Viewed 211,069 times",140,https://stackoverflow.com/questions/29280470/what-is-timeit-in-python
Eugene S,Inheritance and Overriding __init__ in python,"Viewed 208,276 times",140,https://stackoverflow.com/questions/753640/inheritance-and-overriding-init-in-python
mpen,Python - When to use file vs open,"Viewed 90,234 times",140,https://stackoverflow.com/questions/112970/python-when-to-use-file-vs-open
Kara,Should all Python classes extend object? [duplicate],"Viewed 57,663 times",140,https://stackoverflow.com/questions/15374857/should-all-python-classes-extend-object
Stevoisiak,What is the difference between setUp() and setUpClass() in Python unittest?,"Viewed 64,050 times",140,https://stackoverflow.com/questions/23667610/what-is-the-difference-between-setup-and-setupclass-in-python-unittest
Community,How to install a specific version of a package with pip? [duplicate],"Viewed 171,411 times",140,https://stackoverflow.com/questions/13916820/how-to-install-a-specific-version-of-a-package-with-pip
Bill the Lizard,How can I save my secret keys and password securely in my version control system?,"Viewed 36,508 times",140,https://stackoverflow.com/questions/11575398/how-can-i-save-my-secret-keys-and-password-securely-in-my-version-control-system
Vernon,Emacs bulk indent for Python,"Viewed 46,796 times",140,https://stackoverflow.com/questions/2585091/emacs-bulk-indent-for-python
Chris B.,"How do I fix PyDev ""Undefined variable from import"" errors?","Viewed 119,526 times",140,https://stackoverflow.com/questions/2112715/how-do-i-fix-pydev-undefined-variable-from-import-errors
Community,What algorithm does python's sorted() use? [duplicate],"Viewed 132,615 times",140,https://stackoverflow.com/questions/10948920/what-algorithm-does-pythons-sorted-use
Jim Jam,How to call Base Class's __init__ method from the child class? [duplicate],"Viewed 201,452 times",140,https://stackoverflow.com/questions/19205916/how-to-call-base-classs-init-method-from-the-child-class
Trooper Z,What is the right way to debug in iPython notebook?,"Viewed 121,692 times",140,https://stackoverflow.com/questions/32409629/what-is-the-right-way-to-debug-in-ipython-notebook
Community,Moving x-axis to the top of a plot in matplotlib,"Viewed 140,277 times",140,https://stackoverflow.com/questions/14406214/moving-x-axis-to-the-top-of-a-plot-in-matplotlib
Ali,Python Script execute commands in Terminal [duplicate],"Viewed 391,834 times",138,https://stackoverflow.com/questions/3730964/python-script-execute-commands-in-terminal
Sabito 錆兎 stands with Ukraine,ImproperlyConfigured: You must either define the environment variable DJANGO_SETTINGS_MODULE or call settings.configure() before accessing settings,"Viewed 261,316 times",138,https://stackoverflow.com/questions/26082128/improperlyconfigured-you-must-either-define-the-environment-variable-django-set
Giorgos Myrianthous,List Highest Correlation Pairs from a Large Correlation Matrix in Pandas?,"Viewed 175,801 times",138,https://stackoverflow.com/questions/17778394/list-highest-correlation-pairs-from-a-large-correlation-matrix-in-pandas
ninjagecko,How to convert list of key-value tuples into dictionary?,"Viewed 142,050 times",138,https://stackoverflow.com/questions/6586310/how-to-convert-list-of-key-value-tuples-into-dictionary
ZygD,How to change a dataframe column from String type to Double type in PySpark?,"Viewed 347,437 times",138,https://stackoverflow.com/questions/32284620/how-to-change-a-dataframe-column-from-string-type-to-double-type-in-pyspark
cs95,Convert pandas Series to DataFrame,"Viewed 357,212 times",138,https://stackoverflow.com/questions/26097916/convert-pandas-series-to-dataframe
homocomputeris,How to check BLAS/LAPACK linkage in NumPy and SciPy?,"Viewed 87,190 times",138,https://stackoverflow.com/questions/9000164/how-to-check-blas-lapack-linkage-in-numpy-and-scipy
Community,How to measure time taken between lines of code in python?,"Viewed 176,284 times",138,https://stackoverflow.com/questions/14452145/how-to-measure-time-taken-between-lines-of-code-in-python
Jonathan Benn,How to convert string to Title Case in Python?,"Viewed 170,492 times",138,https://stackoverflow.com/questions/8347048/how-to-convert-string-to-title-case-in-python
nbro,How do I find the maximum of 2 numbers?,"Viewed 228,566 times",138,https://stackoverflow.com/questions/3357369/how-do-i-find-the-maximum-of-2-numbers
Trenton McKinney,How to split text without spaces into list of words,"Viewed 96,098 times",138,https://stackoverflow.com/questions/8870261/how-to-split-text-without-spaces-into-list-of-words
mxdbld,Strip / trim all strings of a dataframe,"Viewed 275,775 times",138,https://stackoverflow.com/questions/40950310/strip-trim-all-strings-of-a-dataframe
user2357112,Is there an expression for an infinite iterator?,"Viewed 78,621 times",138,https://stackoverflow.com/questions/5737196/is-there-an-expression-for-an-infinite-iterator
Timur Shtatland,How do I exchange keys with values in a dictionary? [duplicate],"Viewed 128,243 times",138,https://stackoverflow.com/questions/1031851/how-do-i-exchange-keys-with-values-in-a-dictionary
"
        21 revs, 12 users 42%",What is the current choice for doing RPC in Python? [closed],"Viewed 124,667 times",139,https://stackoverflow.com/questions/1879971/what-is-the-current-choice-for-doing-rpc-in-python
Willi Mentzel,Compact way of writing (a + b == c or a + c == b or b + c == a),"Viewed 14,131 times",136,https://stackoverflow.com/questions/32085675/compact-way-of-writing-a-b-c-or-a-c-b-or-b-c-a
Stevoisiak,How to compile python script to binary executable,"Viewed 350,223 times",137,https://stackoverflow.com/questions/12339671/how-to-compile-python-script-to-binary-executable
Community,How to pickle or store Jupyter (IPython) notebook session for later,"Viewed 60,669 times",137,https://stackoverflow.com/questions/34342155/how-to-pickle-or-store-jupyter-ipython-notebook-session-for-later
Manoj Govindan,Is there a generator version of `string.split()` in Python?,"Viewed 34,933 times",137,https://stackoverflow.com/questions/3862010/is-there-a-generator-version-of-string-split-in-python
cha0site,correct way to use super (argument passing),"Viewed 174,696 times",137,https://stackoverflow.com/questions/8972866/correct-way-to-use-super-argument-passing
martineau,Regular expression matching a multiline block of text,"Viewed 335,248 times",137,https://stackoverflow.com/questions/587345/regular-expression-matching-a-multiline-block-of-text
Eric O Lebigot,"Matplotlib: ""Unknown projection '3d'"" error","Viewed 117,849 times",137,https://stackoverflow.com/questions/3810865/matplotlib-unknown-projection-3d-error
Community,Any reason not to use '+' to concatenate two strings?,"Viewed 202,837 times",137,https://stackoverflow.com/questions/10043636/any-reason-not-to-use-to-concatenate-two-strings
smci,Are for-loops in pandas really bad? When should I care?,"Viewed 28,296 times",137,https://stackoverflow.com/questions/54028199/are-for-loops-in-pandas-really-bad-when-should-i-care
SilentGhost,Is there a Python caching library?,"Viewed 133,657 times",137,https://stackoverflow.com/questions/1427255/is-there-a-python-caching-library
आनंद,"What's the difference between MySQLdb, mysqlclient and MySQL connector/Python?","Viewed 83,733 times",137,https://stackoverflow.com/questions/43102442/whats-the-difference-between-mysqldb-mysqlclient-and-mysql-connector-python
Aran-Fey,Is there a way to pass optional parameters to a function?,"Viewed 257,423 times",137,https://stackoverflow.com/questions/14017996/is-there-a-way-to-pass-optional-parameters-to-a-function
Seanny123,Best way to assert for numpy.array equality?,"Viewed 74,333 times",137,https://stackoverflow.com/questions/3302949/best-way-to-assert-for-numpy-array-equality
Andriy,Iterate over the lines of a string,"Viewed 155,939 times",137,https://stackoverflow.com/questions/3054604/iterate-over-the-lines-of-a-string
Mark Amery,Python Requests package: Handling xml response,"Viewed 169,570 times",137,https://stackoverflow.com/questions/18308529/python-requests-package-handling-xml-response
Peter Mortensen,Test a string for a substring [duplicate],"Viewed 283,549 times",137,https://stackoverflow.com/questions/5473014/test-a-string-for-a-substring
ndmeiri,Instance variables vs. class variables in Python,"Viewed 104,073 times",135,https://stackoverflow.com/questions/2714573/instance-variables-vs-class-variables-in-python
thefourtheye,Appending to list in Python dictionary [duplicate],"Viewed 360,012 times",135,https://stackoverflow.com/questions/26367812/appending-to-list-in-python-dictionary
